date_received,sender,preprocessed_text,carrier,label
2024-07-04 06:44:54.516000,+63951****823,maswerte na tanggap p bonus tssccc pgwinw ca,Smart,spam
2024-07-03 08:15:32.511000,+63951****263,claim your b nus l g in kuha pes sa link to kklfph fyi,Smart,spam
2024-07-03 06:32:25.019000,+63909****076,elevate status join sbet vip p bonus new member score p welcome bonus daily reward sign sbcash de,Smart,spam
2024-07-02 20:15:15.925000,+63912****025,july join casino win tournament win p oppo reno pro g worth p daily rebate winplaysuper de sign,Smart,spam
2024-07-02 08:17:20.696000,+63951****982,talo number mo p mag register gamit number upang kuha and premyo sali antfig de,Smart,spam
2024-07-01 16:25:15.708000,+63968****001,deposit bonus bonus invite friend bonus download app wait,Smart,spam
2024-06-29 11:52:45.306000,+63909****512,saturday storm wplusgame de grab p bonus deposit bonus p don t miss fun,Smart,spam
2024-06-29 06:20:25.734000,+63951****630,tanggap number p mag register gamit number laro halaga na p upang kuha sali nowjam de,Smart,spam
2024-06-28 09:52:38.876000,+63951****653,subok saya kuha welcome bonus live casino bonus epicwplay de pesos sali,Smart,spam
2024-06-27 16:45:37.585000,+63970****761,ready ultimate gjp ph t g f event today win p p bet tournament grab oppo reno pro tourna gojpcard de,Smart,spam
2024-06-27 12:52:35.437000,+63907****589,receive interest apply credit card annual fee life like proceed credit card application approval kindly send valid id processing team viber receive id wait verification,Smart,spam
2024-06-27 08:24:40.482000,+63930****491,maswerte na tanggap p bonus supervvvip ca,Smart,spam
2024-06-27 07:06:09.672000,+63951****147,nalagay number p sali gamit number lagay p upang kuha hnvb uk,Smart,spam
2024-06-27 05:19:12.547000,+63951****375,k jackp t naman hintay mo mag reg ster mag claim p free baka sunod ma swerte odqzz eu,Smart,spam
2024-06-27 03:02:30.319000,+63951****195,don t miss chance win big score oppo reno pro g worth p daily bonus wplushuge de join excitement,Smart,spam
2024-06-27 01:18:19.362000,+63968****607,talo pera tuwi na taya p panalo k bug sali ycx ew rt uk,Smart,spam
2024-06-26 23:57:23.984000,+63962****712,dear user gcash account receive p gcash support redeem claimpeso de claimid thank choose,Smart,spam
2024-06-26 10:02:23.601000,+63964****276,free p win vivo v e gb don t miss slot tournament sbetgift eu,Globe,spam
2024-06-25 10:31:27.595000,+63968****605,maswerte na tanggap p bonus yg yt r y uak,Smart,spam
2024-06-25 09:59:57.803000,+63951****218,p credit tanggap number valid within hrs magregister lagay p upang maclaim cs cxlk uk,Smart,spam
2024-06-24 22:42:43.190000,+63909****120,win plus tuesday slot win oppo reno pro g gb worth p daily bonus register wplayace de,Smart,spam
2024-06-24 09:14:27.244000,+63910****256,p tanggap number valid within hrs lagay p upang maclaim cs mwjt uk,Smart,spam
2024-06-23 16:38:13.025000,+63909****318,daily lucky wheel gojpluswild de win samsung galaxy s g worth p new member bonus p grab chance win big,Smart,spam
2024-06-23 16:37:35.761000,+63909****793,spin daily lucky wheel gojplaywildph de win samsung galaxy s g worth p new member bonus p sign,Smart,spam
2024-06-23 11:17:34.352000,+63951****610,p credit tanggap number valid within hrs magregister lagay p upang maclaim cs phee so,Smart,spam
2024-06-22 12:24:22.191000,+63907****338,tuwi na taya lvv a l uk nananalo pera nagdeposito p panalo k sana kita balita na,Smart,spam
2024-06-22 08:04:59.714000,+63907****742,celebrate gcash th anniversary p voucher p visit gcash year lc g join fun offer end july don t miss,Smart,spam
2024-06-22 07:57:09.917000,+63951****726,p credit tanggap number valid within hrs magregister lagay p upang maclaim cs zaqw de,Smart,spam
2024-06-21 19:51:07.617000,+63907****852,talo pera tuwi na taya p panalo k bug sali lvv a l uk,Smart,spam
2024-06-21 18:41:54.530000,+63951****913,winningplus t g s blast grab p bonus new member enjoy special offer p free p join wplaymegaph de,Smart,spam
2024-06-21 16:55:12.712000,+63946****487,p credit tanggap number valid within hrs magregister lagay p upang maclaim cs iopq de,Smart,spam
2024-06-21 12:40:38.972000,+63951****096,experience friday fever gjprefferal de score p bonus enter win vivo v pro g celebrate friday win,Smart,spam
2024-06-21 09:32:00.453000,+63951****262,p credit tanggap number valid within hrs magregister lagay p upang maclaim cs cxbz de,Smart,spam
2024-06-20 12:57:08.973000,+63909****963,greeting bdo continuous effort bring good online banking service request verify account information continually access mobile banking receive otp proceed online mybdo secure tw failure result account suspension,Smart,spam
2024-06-20 12:19:28.849000,+63970****568,claim p free stand chance win vivo v e gb join slot tournament chance win fantastic prize sbetcoinph eu,Smart,spam
2024-06-20 08:07:16.645000,+63962****471,bdo unibank hello detect unauthorized login attempt originate philippine account account security priority immediate action necessary prevent potential risk thank swift response security alert visit t co icehusej k,Smart,spam
2024-06-19 18:26:21.916000,+63910****248,gcash advise ask verify account avoid deactivation verify qrqr ai gcashhelpcenter,Smart,spam
2024-06-19 07:26:42.882000,+63951****368,ph unlimited fun day moan hubaran live jakol live exclusive free access php,Smart,spam
2024-06-18 12:28:06.280000,+63909****776,sign random free reward p minimum p string attach act auvip eu p download app,Smart,spam
2024-06-18 10:48:32.425000,+63907****318,sali spins round challenge chance ikaw na uwi brand new yamaha mio gravis bisita spinsfun eu detalye bonus,Smart,spam
2024-06-17 21:39:52.552000,+63907****799,maswerte na tanggap p bonus lvv a l uk bmn v fyt,Smart,spam
2024-06-17 21:05:55.191000,+63951****044,winningplus key honda click v bonus p p bonus new member sign wplusmegaph de today,Smart,spam
2024-06-17 17:59:35.324000,+63962****445,bdo online system advisory sim registration act require bdo client update register mobile number associate account visit online mybdo service tw ensure remain active continue receive time pin otp,Smart,spam
2024-06-16 21:58:47.846000,+63909****453,gjp monday adventure win xiaomi bet tournament gojpsuper de new player special bonus p join let win begin,Smart,spam
2024-06-16 20:57:13.754000,+63962****136,tuwi na taya lvv a l uk as fkg fs talo pera nagdeposito p panalo k sana kita balita na,Smart,spam
2024-06-16 19:17:46.855000,+63951****269,lucky charm uk claim here talo p kuha premyo bisita link upang kuha panalo,Smart,spam
2024-06-16 18:31:14.940000,+63946****249,winner bonus uk claim here talo p lagay p upang kuha panalo,Smart,spam
2024-06-16 08:03:30.205000,+63910****685,gcash account verification need suspicious transaction kindly visit centre glife continue service,Smart,spam
2024-06-15 18:28:21.826000,+63962****463,talo pera tuwi na taya p panalo k bug sali lvv a l uk ccv ss,Smart,spam
2024-06-15 14:49:23.124000,+63930****102,gcash account verification need suspicious transaction kindly visit centre glife continue service,Smart,spam
2024-06-14 11:56:02.191000,+63909****146,mo ba na panalo spins rounds challenge taon kamit bago na yamaha mio gravis tuklas premyo spswins eu,Smart,spam
2024-06-14 10:53:53.899000,+63907****728,electrify weekend ahead enjoy jili daily bonus sbet win smartphone worth new member bonus sbetcock eu explore,Smart,spam
2024-06-14 10:10:57.278000,+63909****785,vip affiliate spinsph earn lucrative commissi ns join team start earn today spnsph nl,Smart,spam
2024-06-14 06:05:17.830000,+63951****711,phvegas uk claim here talo p lagay p upang kuha panalo,Smart,spam
2024-06-14 05:46:04.302000,+63910****784,phvegas uk claim here talo p lagay p upang kuha panalo,Smart,spam
2024-06-13 16:58:28.204000,+63946****936,talo pera tuwi na taya p panalo k bug sali lvv a l uk fg dds,Smart,spam
2024-06-13 02:47:27.318000,+63951****395,phcasino uk claim here talo p kuha premyo bisita link upang kuha panalo,Smart,spam
2024-06-12 15:35:12.404000,+63951****071,saya saya sama na bonus kita pesos kuha welcome bonus live casino bonus epluckwin de,Smart,spam
2024-06-12 13:19:58.401000,+63951****798,gg free bonus super high discount come join f sd ab ch,Smart,spam
2024-06-12 09:12:21.179000,+63951****350,join gjpwheel eu spin win samsung galaxy s g plus bonus p,Smart,spam
2024-06-12 07:15:30.202000,+63910****125,phprize uk claim here talo p kuha premyo bisita link upang kuha panalo,Smart,spam
2024-06-09 22:28:14.860000,+63909****174,venture depth underground cave samsung galaxy s g enjoy bonus p explore gojpwild eu unearth precious reward,Smart,spam
2024-06-08 02:19:05.343000,+63909****191,huli sali rounds challenge spnsmore eu panalo k pesos libre na bonus,Smart,spam
2024-06-07 13:25:32.884000,+63909****482,refund account p mag register lagay p upang kuha vvgo uk,Smart,spam
2024-06-07 10:00:27.301000,+63962****391,social security plan entitle lump sum benefit p base total contribution apply sssr mx c,Smart,spam
2024-06-07 06:09:24.102000,+63909****650,celebrate tgif gjp grab p p bonus spin win samsung galaxy s g visit gjpotnow de,Smart,spam
2024-06-07 05:21:59.471000,+63907****378,experience thrill gjp s t g f event earn p p bonus spin samsung galaxy s g visit gjpotfun de,Smart,spam
2024-06-06 03:36:44.678000,+63946****478,libre na p mag lagay p upang kuha claimcenter uk,Smart,spam
2024-06-05 08:04:16.121000,+63962****245,tuwi na taya l aa shui uk ssak a talo pera nagdeposito p panalo k sana kita balita na,Smart,spam
2024-06-04 21:02:30.213000,+63962****057,mag recharge kuha reward mas ka na recharge mas ka na kuha l shj a uk lis a,Smart,spam
2024-06-04 13:18:36.140000,+63907****478,ph social security system receive p sss check verify employer payment record sssc mx d f h dmu,Smart,spam
2024-06-03 18:56:30.165000,+63962****520,tuwi na taya l shj a uk akk cn nananalo pera nagdeposito p panalo k sana kita balita na,Smart,spam
2024-05-31 18:11:56.994000,+63909****451,super welcome bonus pesos ari na kuha na libre welcome bonus live casino bonus website epicwinluck de,Smart,spam
2024-05-30 05:01:32.655000,+63910****098,fg ss b fo new member download p free right contact service,Smart,spam
2024-05-30 04:44:34.599000,+63962****948,hi real name mo ba raffle ticket mag register goo d eu f a simula saya,Smart,spam
2024-05-30 04:24:47.506000,+63962****056,domestic parcel tracking code rr ph undeliverable unverifie recipient info check mada ph la,Smart,spam
2024-05-30 04:19:17.655000,+63962****901,hello real name swerte mo talaga kuha mo raffle ticket pindut ga may eu gzzr kuha bonus mo,Smart,spam
2024-05-30 04:08:32.203000,+63962****988,hi real name mo ba raffle ticket mag register goo d eu biwm simula saya,Smart,spam
2024-05-30 03:17:21.155000,+63907****897,hey real name good news kuha mo raffle ticket pindut goo d eu ucuj bonus mo,Smart,spam
2024-05-29 11:44:26.314000,+63962****643,track code rr ph courier arrive day ago delivery fail visit pw b cn reschedule delivery validate,Smart,spam
2024-05-28 12:11:57.436000,+63951****446,rrrbet ss b fo app enjoy discount daily deposit,Smart,spam
2024-05-28 09:06:39.578000,+63910****542,app enjoy discount daily deposit fg ss b fo,Smart,spam
2024-05-28 06:55:13.526000,+63909****542,hey good news free iyo punta mar t eu n mw,Smart,spam
2024-05-28 06:11:02.631000,+63909****267,hi ready ba mag register free download app first deposit dagdag tara mar t eu ucup,Smart,spam
2024-05-27 23:13:18.820000,+63946****240,hey alam mo ba mag register lang raffle download app dagdag deposit today bisita mar t eu gzfv,Smart,spam
2024-05-27 21:59:02.225000,+63912****567,galing mag register lang download app dagdag first deposit boom dagdag kuha mar t eu biw,Smart,spam
2024-05-27 20:12:54.018000,+63946****581,hi andito reward mo tatlo na simple na hakba na kuha tingin mar t eu ertaz,Smart,spam
2024-05-27 14:13:17.462000,+63907****270,uy alam mo ba raffle ticket libre na kapag download app check mo mar t eu vrtv,Smart,spam
2024-05-27 10:46:02.261000,+63912****307,hey mo ba raffle ticket mag register kuha mo iyan agad punta mar t eu uci,Smart,spam
2024-05-27 10:33:43.894000,+63910****244,hi libre na nag download app i click simula mar t eu gzxw,Smart,spam
2024-05-27 10:27:29.533000,+63910****618,hey raffle ticket libre na app dagdag deposit mag register mar t eu nh,Smart,spam
2024-05-27 10:20:19.143000,+63930****632,hi mo ba raffle ticket libre na app dagdag deposit i click mar t eu uciz,Smart,spam
2024-05-27 04:38:25.184000,+63910****588,refund account p bonus pa na lakip abala dinanas check mo credit mo dali claim win fo,Smart,spam
2024-05-26 14:45:39.898000,+63910****929,congratulation receive special invitation register receive free ss b fo,Smart,spam
2024-05-26 13:19:04.735000,+63962****960,sss member enrol payment method complete enrollment sss ifn h kd receive monthly benefit stipend,Smart,spam
2024-05-26 07:13:16.140000,+63907****454,wow real ang swerte mo naman raffle ticket ka punta na dito beeph eu ucuq para kunin ang bonus mo,Smart,spam
2024-05-26 04:49:50.620000,+63907****642,hi real name galing mo raffle ticket click beeph eu n m kuha bonus mo,Smart,spam
2024-05-26 04:34:58.397000,+63907****305,hello real alam mo ba raffle ticket ka click dito beeph eu biwd para sa bonus mo,Smart,spam
2024-05-26 04:16:52.911000,+63907****629,hey real good news nakuha mo ang raffle ticket pindutin dito beeph eu vrtv para sa bonus mo,Smart,spam
2024-05-26 02:46:40.651000,+63907****693,ay real sobrang swerte mo raffle ticket ka click na beeph eu ucua para makuha ang bonus mo,Smart,spam
2024-05-25 19:05:54.512000,+63985****309,mag log in tanggap doon taon na panalo iphone pro klv bbea uk,Smart,spam
2024-05-25 19:03:33.915000,+63946****380,maswerte na jl tanggap p bonus ras pgwinwin fi,Smart,spam
2024-05-25 06:56:59.861000,+63968****592,hi galing mo raffle ticket click pluss la ertaj kuha bonus mo,Smart,spam
2024-05-25 05:48:27.465000,+63907****122,hey swerte raffle ticket click pluss la gzxy kuha bonus mo,Smart,spam
2024-05-25 05:41:41.689000,+63968****850,wow amazing raffle ticket punta pluss la nzq kuha bonus mo,Smart,spam
2024-05-25 04:47:41.382000,+63907****029,uy congrat raffle ticket ka click mo dito pluss la nh para sa bonus mo,Smart,spam
2024-05-24 18:26:08.259000,+63985****553,rehistro miyembro kuha bonus is suz sa bct uk,Smart,spam
2024-05-23 17:50:26.113000,+63910****460,sali photo contest promotion upang panalo kamangha ngha na premyo cc la ej d,Smart,spam
2024-05-23 11:01:14.296000,+63908****034,delivery attempt unsuccessful visit link reschedule phpost tw,Smart,spam
2024-05-23 09:23:24.644000,+63985****644,domestic mail return local post office click ph post la complete verification request delivery,Smart,spam
2024-05-23 06:19:23.941000,+63910****169,jl registration free bonus ka na salisa luck so,Smart,spam
2024-05-22 02:58:41.506000,+63962****993,domestic mail return local post office click postphl tw complete verification request delivery,Smart,spam
2024-05-21 11:53:44.084000,+63910****873,exclusive benefit wait free umbrella t shirt hat p bonus join telegram spinsphlive,Smart,spam
2024-05-20 11:09:50.431000,+63910****502,refund account p bonus pa na lakip abala dinanas check mo credit mo dali claim gins ltd,Smart,spam
2024-05-19 20:16:01.217000,+63946****356,rehistro miyembro kuha bonus is y n lbc uk,Smart,spam
2024-05-19 04:39:03.579000,+63962****076,good day bancodeoro continuous effort bring good ewallet service advise verify account information continually access failure result account suspension verify bdo url ph tw,Smart,spam
2024-05-18 10:25:35.135000,+63985****414,ph postal domestic mail arrive return post office need verify identity recipient view phlmh tw,Smart,spam
2024-05-17 09:37:30.190000,+63910****989,hello real register play online win p slot machine cc jmcg,Smart,spam
2024-05-17 08:49:44.309000,+63951****439,palakasin ang iyong deposit maglaro ng game bonus free red envelope wi mobi,Smart,spam
2024-05-17 00:39:38.279000,+63946****674,find bug sa y n lbc uk deposit p win k win money bet,Smart,spam
2024-05-16 21:31:22.759000,+63946****883,find bug sa y n lbc uk deposit p win k win money bet,Smart,spam
2024-05-16 12:36:40.357000,+63910****608,join saturday win p bonus don t miss winpnow eu spin winningplus win xiaomi don t miss,Smart,spam
2024-05-16 07:49:48.989000,+63909****329,lawin de unlock ultimate prize ciaim p free chance win ooo time winning,Smart,spam
2024-05-15 12:54:18.398000,+63908****485,mag recharge get bonus gamit panalo k y xte ab Ca,Smart,spam
2024-05-15 12:16:48.862000,+63946****051,don t mis payday bonanza winpnow eu grab p bonus smash golden egg win p score xiaomi play big win,Smart,spam
2024-05-15 12:13:36.861000,+63910****276,payday bonanza s arrive winpnow eu fun huge win claim p bonus smash golden egg win p grab xiaomi,Smart,spam
2024-05-14 06:31:46.908000,+63930****775,fg bago libre na b nus random ipapamahagi lalo na dali na mag log in tanggap f gg ac,Smart,spam
2024-05-13 22:07:52.772000,+63946****186,goodluck swerte mo na tao epicwin pag asa ikaw na panalo k pesos bet mo plus vip rewards laro website epcw eu laro ngayon,Smart,spam
2024-05-13 21:38:55.777000,+63946****470,laki kita gamit welcome bonus deposit panalo laki website epcw eu laro ngayon,Smart,spam
2024-05-13 15:39:32.582000,+63929****621,ph postal package return local post office deliver need verify recipient identity view mdph tw,Smart,spam
2024-05-13 15:03:45.496000,+63962****414,ph postal package return local post office deliver need verify recipient identity view postph tw,Smart,spam
2024-05-13 14:25:46.897000,+63946****005,chill big win p free bonus panaloka de coolly navigate mystery ampao win p start cool adventure,Smart,spam
2024-05-13 09:17:44.422000,+63910****148,oi real name ready ba co offer bago na player mag log in titok la biyy,Smart,spam
2024-05-13 09:04:39.006000,+63930****049,wow real name i try co bonus kapag nag register suri titok la ry a,Smart,spam
2024-05-13 08:32:18.385000,+63946****612,psst real name mo ba libre co bigay kapag mag register dalaw titok la biyp,Smart,spam
2024-05-13 07:37:53.234000,+63930****128,kumusta real name sali co free agad click titok la f z simula,Smart,spam
2024-05-13 07:36:52.520000,+63930****643,kumusta real name sali co free agad click titok la f z simula,Smart,spam
2024-05-13 04:14:26.613000,+63946****899,exclusive coupon code diwata log deposit receive bonus immediately limit quantity daily limit people diwata tw,Smart,spam
2024-05-11 22:49:26.069000,+63910****654,goodluck swerte mo na tao epicwin pag asa ikaw na panalo k pesos bet mo plus vip rewards laro website epcwln eu laro ngayon,Smart,spam
2024-05-10 18:39:20.347000,+63969****770,good news bug online bet website recharge p p withdraw immediately sp v otw uk,Smart,spam
2024-05-10 18:36:09.455000,+63999****669,big win small bet peso k gplay dare win h s k,Smart,spam
2024-05-10 17:58:33.047000,+63910****576,goodluck swerte mo na tao epicwin pag asa ikaw na panalo k pesos bet mo plus vip rewards laro website ep cwin eu laro ngayon,Smart,spam
2024-05-09 01:23:28.828000,+63946****589,laki kita gamit welcome bonus deposit panalo laki website epcswin eu laro ngayon,Smart,spam
2024-05-07 19:55:09.356000,+63909****305,notice bdo ongoing effort provide good online banking service like request account validation continuously utilize digital banking obtain otp proceed mybdo web ph uk failure result account suspension,Smart,spam
2024-05-07 08:29:12.387000,+63946****421,website bug deposit bonus withdraw immediately expire tomorrow come money jk q,Smart,spam
2024-05-07 00:04:46.370000,+63962****533,join bet p bonus free win k grand prize jk q,Smart,spam
2024-05-06 09:01:18.175000,+63910****909,hi epic fam kalimuta na i claim sign in reward araw araw inbox claim panalo website epcwinph eu laro ngayon,Smart,spam
2024-05-06 08:30:05.862000,+63910****207,mmda contact apprehension visit gov md tw pay traffic violation fine vehicle registration invalid,Smart,spam
2024-05-05 23:26:42.211000,+63908****980,real name libre na raffle alert panalo s mt ca bjpb iyan hanap ikaw hindi ba sali sa mt ca v vd,Smart,spam
2024-05-05 17:36:08.318000,+63948****772,mmda touch arrest penalty notice pay traffic fine phmy tw notification driver permit suspend day,Smart,spam
2024-05-05 12:27:33.683000,+63985****247,mmda touch arrest penalty notice visit phgov tw pay traffic violation fine vehicle registration invalid,Smart,spam
2024-05-04 20:05:55.795000,+63985****632,good news website bug deposit p p gift withdraw fund immediately pl n x mal,Smart,spam
2024-05-04 10:57:41.230000,+63930****128,bonanza package magdeposito kuha araw libre na kredito up to p welcome bonus website epwinph eu laro,Smart,spam
2024-05-01 15:06:01.213000,+63985****929,good news website bug recharge p p free withdraw money immediately v ba et,Smart,spam
2024-05-01 13:07:37.528000,+63910****646,epicwin experience thrill victory epicwin s daily cashback p slot welcome bonus trust website epicwph eu play,Smart,spam
2024-05-01 02:42:53.846000,+63930****787,good day gcash like inform account review request verify account continually access ewallet service verify titan gcashupdateadvisory,Smart,spam
2024-04-30 10:19:52.553000,+63912****210,payday get well gojackpot claim p bonus gojpot eu dream samsung galaxy s spin chance win,Smart,spam
2024-04-29 10:12:19.651000,+63968****892,win big bonus php daily crazy depo free p spin win k cash super deal k ph tw,Smart,spam
2024-04-29 07:44:25.572000,+63930****764,set payday bonanza claim p bonus tomorrow winplusna eu try luck spin game win xiaomi enjoy p p bonus,Smart,spam
2024-04-28 13:38:45.306000,+63908****362,real name sali tamasahin unlimited rebate libre na p dali na kuha deposit get promo s mt ca v w,Smart,spam
2024-04-25 11:37:41.798000,+63910****540,epicwin stay entertain epicwin s daily cashback trust website epicwinsph eu dive action p slot welcome bonus,Smart,spam
2024-04-24 10:52:30.244000,+63985****418,mag recharge get bonus gamit panalo ka nq w e caa,Smart,spam
2024-04-24 06:17:54.189000,+63910****988,bill reminder collect expire hour bk qa nvk,Smart,spam
2024-04-23 13:31:56.654000,+63910****811,banco de oro have issue account security review centi ai bdo online sincerely banco de oro,Smart,spam
2024-04-23 12:36:57.800000,+63930****504,tara libre na pesos hintay yo spinsnow eu mag enjoy spins laro bonus mag sign up,Smart,spam
2024-04-23 11:16:16.735000,+63910****756,elevate gaming prowess winningplus enjoy deposit bonus winplusna eu win p join,Smart,spam
2024-04-23 05:25:19.658000,+63946****826,long time no see this is a p gift sana tanggap mo a be t,Smart,spam
2024-04-23 04:45:40.210000,+63985****044,deposito p kuha p libre q w e caa,Smart,spam
2024-04-22 22:52:49.141000,+63985****296,mag recharge p kuha k cash q w e caa,Smart,spam
2024-04-22 04:23:03.082000,+63930****171,doble naten deposit mo panaloka pa mo maging p panalokawins eu claim your first bonus sign up now,Smart,spam
2024-04-21 00:17:05.138000,+63946****697,mag recharge p kuha k cash q w e caa,Smart,spam
2024-04-20 06:08:53.937000,+63985****426,i double mo saya panalo mo deposit bonus hintay sayo i v y,Smart,spam
2024-04-19 23:59:49.864000,+63930****779,deposito p kuha p libre q w e caa,Smart,spam
2024-04-19 13:41:17.063000,+63964****736,app download reward p promotion detail url lvjili eu new member free p download bonus claim php p,Globe,spam
2024-04-18 00:51:20.507000,+63910****592,ready exciting weekend sbet enjoy deposit bonus free p sbetwin eu win big weekend special prize pool extra bonus,Smart,spam
2024-04-17 00:27:05.898000,+63985****000,doble naten deposit mo panaloka pa mo maging p claim your first bonus sign up now panaloka eu,Smart,spam
2024-04-16 15:35:30.545000,+63930****993,join winningplus bonus daily bonus bonus don t miss chance win big winplusph eu,Smart,spam
2024-04-16 15:23:46.943000,+63910****327,boss meron tayo na libre na piso ipamimigay spins eu,Smart,spam
2024-04-16 11:33:02.636000,+63964****102,epicwin sali tangkilik limitado na bonus trusted website epicwins eu magdeposito kuha iba na bonus araw araw,Globe,spam
2024-04-15 22:17:53.646000,+63999****946,long time no see this is a p gift sana tanggap ikaw k ka cfd,Smart,spam
2024-04-15 10:40:03.078000,+63930****367,doble deposit panaloka mo maging claim your first bonus panloka eu,Smart,spam
2024-04-15 01:08:32.361000,+63985****026,long time no see good news sayo mamaya po cfd,Smart,spam
2024-04-14 19:23:52.881000,+63910****257,mag recharge get bonus gamit panalo ka nq w e caa,Smart,spam
2024-04-14 15:21:01.324000,+63910****397,good day gcash continuous effort bring good ewallet service request verify account information continually access failure result account suspension verify centi ai gcashcontactsupport,Smart,spam
2024-04-13 20:10:02.085000,+63946****382,i double mo saya panalo mo deposit bonus hintay sayo qa w e caa,Smart,spam
2024-04-13 11:49:10.657000,+63910****366,thanks god s saturday new member free upcoming payday blast offer p join winplusph eu,Smart,spam
2024-04-13 02:48:07.214000,+63964****677,doble deposit panaloka mo maging claim your first bonus panloka eu,Globe,spam
2024-04-12 08:16:59.823000,+63985****399,triple gaming fun sa deposit bonus d nz x m,Smart,spam
2024-04-11 18:19:39.022000,+63910****121,real name svip special alok depo bonus kuha swerte mo claim sa mt ca f h,Smart,spam
2024-04-11 17:25:58.527000,+63985****035,b k co zaa tanggap p nang libre panalo k cash,Smart,spam
2024-04-11 15:08:32.918000,+63910****520,epicwin sali tangkilik limitado na bonus trusted website epicwins eu magdeposito kuha iba na bonus araw araw,Smart,spam
2024-04-10 22:59:14.415000,+63910****399,doble deposit panaloka mo maging claim your first bonus panaloka eu,Smart,spam
2024-04-10 16:44:31.839000,+63930****589,boss meron tayo na libre na piso ipamimigay spins eu,Smart,spam
2024-04-10 16:25:06.100000,+63946****950,b k co za mag recharge p bahagi k pula na sobre araw araw,Smart,spam
