date_received,sender,preprocessed_text,carrier,label
2025-05-30 19:00:12,+6393064***97,hi gcash account temporarily disable update gcash account confirm account gcashaccountfix online thank choose,Smart,spam
2025-05-17 14:19:03,+6393917***20,sit tulong kita p ld basta bahala sa akin kapag nal bigay kita na easyw na laro p ldo agad add msg moko msngr cleia dapon naka red backless dress profile pic,Smart,spam
2025-05-17 15:17:36,+6393917***20,nakapagmessage po ba message mo po guide kita panalo masecure winning slot chance kapa kuha laki na amount ngayon na araw,Smart,spam
2024-12-06 19:42:10,+6393067***41,gjckpotna lat day christmas gojackpot reward deposit bonus friday bonus not miss win chance,Smart,spam
2024-11-13 20:28:35,+6397049***83,catch midweek wave fortune x multiplier slotgame grab chance win p vlvo v pro g gjakpt email,Smart,spam
2024-11-13 16:58:27,+6396155***13,hi po,Smart,spam
2024-10-13 17:21:25,+6396383***95,w plsmega help celebrate family time sunday claim p bonus share achievement facebook extra p win p m,Smart,spam
2024-09-16 10:27:37,+6396124***17,hi po,Smart,spam
2024-09-08 09:17:03,+6391947***61,swerte guro ikaw na gagabay makipag ugnay kay telegram,Smart,spam
2024-08-21 21:11:38,+6390852***66,utos telepono gana kita kita araw araw telegram niy,Smart,spam
2024-08-21 20:23:37,+6395119***03,luck call claim p gjp ph gojpplay golf,Smart,spam
2024-07-19 15:40:29,+6396158***86,congratulation redeem p g cash support claim g gift pt d thank choose gcash online,Smart,spam
2024-06-28 04:50:38,+6393018***65,tanggap number p mag register gamit number laro halaga na p upang kuha cxbz de,Smart,spam
2024-06-27 22:56:02,+6390792***40,ready thrill gjp ph s t g f event tomorrow bag p p bet tournament oppo reno pro tourna gojpwheel de,Smart,spam
2024-06-27 19:53:46,+6395180***47,handa ba na enjoy mag avail welcome bonus live casino bonus pesos epcwnplays de,Smart,spam
2024-06-27 14:07:43,+6394675***82,nalagay number p sali gamit number lagay p upang kuha hnvb uk,Smart,spam
2024-06-27 13:03:36,+6395190***39,k jackp t naman hintay mo mag reg ster mag claim p free baka sunod ma swerte odqzz eu,Smart,spam
2024-06-27 11:14:54,+6394602***46,mag sign up kuha librengspins premium recharge sali link kuha nang libre hnvb uk,Smart,spam
2024-06-27 10:19:27,+6395162***88,embrace win plus win oppo reno pro g gb worth p enjoy daily bonus visit wplustar de register,Smart,spam
2024-06-27 09:23:39,+6395137***19,nalagay number p sali gamit number lagay p upang kuha cxbz de,Smart,spam
2024-06-26 15:24:58,+6393049***25,account verification need suspicious transaction kindly visit cut g ltegcash continue service,Smart,spam
2024-06-27 08:41:34,+6393049***25,gcash account verification need suspicious transaction kindly visit cut gcash g continue service,Smart,spam
2024-06-26 23:44:30,+6395172***01,talo pera tuwi na taya p panalo k bug sali ycx ew rt uk,Smart,spam
2024-06-26 17:03:50,+6395189***51,claim welcome b nus p award claim soon avoid expiry asace wang rbs,Smart,spam
2024-06-26 16:46:56,+6390738***65,claim p free enter slot tournament vivo v e gb prize sbetfortune eu,Smart,spam
2024-06-26 16:31:39,+6391021***80,pili tanggap p sali gamit number lagay p upang ma claim customer support sali pqrm uka,Smart,spam
2024-06-26 16:24:14,+6393049***98,gcash account verification need suspicious transaction kindly visit cut g ltegcash continue service,Smart,spam
2024-06-26 09:24:39,+6393002***58,gcash account verification need suspicious transaction kindly visit cut ltesgcash continue service,Smart,spam
2024-06-26 00:49:15,+6391021***68,p credit tanggap number valid within hrs magregister lagay p upang maclaim cs tfwz uk,Smart,spam
2024-06-25 12:04:41,+6391019***09,p credit tanggap number valid within hrs magregister lagay p upang maclaim cs mwjt uk,Smart,spam
2024-06-25 03:30:59,+6395190***93,win point exciting casino bet tournament new member receive bonus plus additional point join wplushuge de,Smart,spam
2024-06-24 23:59:37,+6396255***82,ph social security system sss total employer contribution benefit expire avoid termination sss benefit check link sssph mx,Smart,spam
2024-06-24 22:51:36,+6395168***80,number win p sign hnvb uk number add p cash customer support,Smart,spam
2024-06-24 17:10:20,+6395168***55,p tanggap number valid within hrs lagay p upang maclaim cs mwjt uk,Smart,spam
2024-06-24 00:46:40,+6395195***51,spin daily lucky wheel gojpluswildph de win samsung galaxy s g worth p new member bonus p join today,Smart,spam
2024-06-22 01:09:59,+6395182***93,winningplus t g s blast p bonus t g s special p free p new member join big win wplaycardph de,Smart,spam
2024-06-21 18:55:05,+6390925***21,tgif mean bonus prize gjpjdb de grab p bonus compete win sleek vivo v pro g friday join today,Smart,spam
2024-06-20 09:46:52,+6395167***49,talo numero na p parehistro xzqt de gamit lagay p ma claim premyo customer support,Smart,spam
2024-06-20 05:21:13,+6394618***91,credit p bonus account lampas lvv a l uk,Smart,spam
2024-06-19 19:59:22,+6390971***86,bdo online system advisory sim registration act require bdo client update register mobile number associate account visit online mybdo app tw ensure remain active continue receive time pin otp,Smart,spam
2024-06-19 14:09:59,+6391247***53,paymaya don t miss php maya voucher expiring soon use june enjoy saving load bill crypto online shopping paymaya uk,Smart,spam
2024-06-18 14:54:03,+6395128***19,ph unlimited fun day moan hubaran live jakol live exclusive free access php,Smart,spam
2024-06-18 00:26:36,+6395185***64,pili tanggap p reward cash uk sali gamit number lagay p upang ma claim customer support,Smart,spam
2024-06-17 21:35:49,+6391077***84,pili tanggap p charm fortune uk sali gamit number lagay p upang ma claim customer support,Smart,spam
2024-06-17 10:44:16,+6395177***20,lucky charm uk claim here talo p lagay p upang kuha panalo customer support,Smart,spam
2024-06-16 10:57:38,+6395164***89,pili tanggap p tija uk sali gamit number lagay p upang ma claim customer support,Smart,spam
2024-06-16 07:23:06,+6390705***35,experience exhilarate winningplus weekend boost grab p bonus indulge weekend special wplusace de join excitement,Smart,spam
2024-06-15 19:44:29,+6390771***07,ph social security system sss total employer contribution benefit expire check ssr mx avoid termination sss benefit,Smart,spam
2024-06-15 18:55:42,+6390951***80,new member sign free p reward extra day limit spot act uuctt eu p download app,Smart,spam
2024-06-14 16:11:12,+6390932***28,join spin round challenge chance manalo ng brand new yamaha mio gravis avail bonus sa spswin eu,Smart,spam
2024-06-14 15:04:59,+6390996***82,gcash advisory advise ask verify account avoid deactivation verify trim ac gcashcare,Smart,spam
2024-06-14 14:46:30,+6390799***87,new member download p o right c ntact service mdsa ch,Smart,spam
2024-06-14 13:27:15,+6390957***71,hey player ready thrill sbet s day slot tournament win p bonus daily giveaway join action sbetdraw eu,Smart,spam
2024-06-13 20:38:06,+6391022***19,phmega uk claim here talo p kuha premyo bisita link upang kuha panalo,Smart,spam
2024-06-13 16:43:13,+6396828***84,maswerte na tanggap p bonus zaqwsx pgwinwin fi,Smart,spam
2024-06-12 15:16:20,+6394671***65,maswerte na tanggap p bonus zaqwsx pgwinwin fi,Smart,spam
2024-06-12 14:51:37,+6394673***86,maswerte na tanggap p bonus zaqwsx pgwinwin fi,Smart,spam
2024-06-12 04:45:50,+6394672***44,mag log in tanggap doon taon na panalo iphone pro lvv a l uk mb fhf sgs a,Smart,spam
2024-06-11 03:16:41,+6391021***85,ilagay account p lagay p upang claim cs claim slot vg,Smart,spam
2024-06-10 00:58:39,+6390959***50,win samsung galaxy s g daily lucky wheel new member bonus php visit gojpwild eu play,Smart,spam
2024-06-09 16:29:32,+6396828***53,hello bagong libreng bonus para sa beuwla ac lxg walang kinakailangang deposito deposit bonus bonus deposit day,Smart,spam
2024-06-08 21:32:58,+6396275***78,bonus geniepot new member daily bonus super free download bonus genlepot ph,Smart,spam
2024-06-08 21:14:11,+6396229***97,bonus geniepot new member daily bonus p free download bonus genlepot ph,Smart,spam
2024-06-08 18:21:22,+6391064***75,nalagay number p mag register gamit number lagay p upang ma claim bonusclaim uk,Smart,spam
2024-06-07 23:31:09,+6396248***72,hello bagong libreng bonus para sa givepot ph g walang kinakailangang deposito deposit bonus bonus deposit day,Smart,spam
2024-06-07 20:33:37,+6396265***56,social security plan entitle lump sum benefit p base total contribution apply sssr mx c,Smart,spam
2024-06-07 15:36:22,+6391092***62,refund account p mag register lagay p upang kuha phslots uk,Smart,spam
2024-06-07 12:26:39,+6394682***07,chat lizzbf gmail com,Smart,spam
2024-06-07 11:07:14,+6390772***97,don t miss join gjp s t g f event p p bonus spin daily win samsung galaxy s g visit gjpotnow de,Smart,spam
2024-07-14 00:32:28,+6395175***62,download app p topup p p free bonus st daily deposit join,Smart,spam
2024-07-13 07:54:11,+6390907***97,epwin welcome bonus k pesos daily rebate sali eppachinko cz,Smart,spam
2024-07-13 04:13:03,+6390958***96,discover winningplus score big tgis thrilling p bonus p free spin sign non stop fun wplsflush cz,Smart,spam
2024-07-12 21:55:26,+6395126***88,epwin tara laro welcome bonus k pesos daily rebate bisita simula panalo epicbeton,Smart,spam
2024-07-12 13:01:47,+6395102***46,bilis dep sit w thdraw ba hanap ikaw punta link lar spsebc eu,Smart,spam
2024-07-12 02:45:55,+6395165***85,s tgif gjp claim free win vivo v pro g slot tournament gjpbet uk join fun,Smart,spam
2024-07-11 06:18:35,+6395162***11,experience win plus win oppo reno pro g gb value p daily bonus winplus sbs enroll today,Smart,spam
2024-07-10 20:11:08,+6391219***86,free slot machine worth million peso wait register p deposit p free rebate website pvej sg,Smart,spam
2024-07-10 18:58:23,+6395144***35,dive hot spin original spinsfun eu claim free plus yamaha mio gravis today don t miss,Smart,spam
2024-07-10 12:01:39,+6393016***86,p credit tanggap number valid within hrs magregister lagay p upang maclaim cs dogcat im,Smart,spam
2024-07-09 19:26:30,+6395178***07,p credit tanggap number valid within hrs magregister lagay p upang maclaim cs moonow so,Smart,spam
2024-07-09 12:55:38,+6391068***62,p credit tanggap number valid within hrs magregister lagay p upang maclaim cs moonow so,Smart,spam
2024-07-09 08:20:12,+6394876***64,g c s h advise ask verify account avoid deactivation click fan g cash helpcenter,Smart,spam
2024-07-09 01:54:32,+6394825***75,g c s h advise ask verify account avoid deactivation click kernel guru g cash helpcenter,Smart,spam
2024-07-08 18:49:12,+6393007***52,jackp t hit min premyo kasi na taas billion download kuha p una na deposito zbpna dhaui ca,Smart,spam
2024-07-08 16:17:41,+6390774***93,start strong sugarplay enjoy bonus deposit p daily rebate new member receive p welcome bonus spslot de,Smart,spam
2024-07-08 10:28:43,+6395176***42,gjp monday excitement spin lucky wheel win samsung galaxy s g worth p new member p welcome bonus visit gjgame de,Smart,spam
2024-07-08 03:50:15,+6395159***65,tanggap number p mag register gamit number laro halaga na p upang kuha sali raypop de,Smart,spam
2024-07-08 03:50:12,+6395136***57,tanggap number p mag register gamit number laro halaga na p upang kuha sali raypop de,Smart,spam
2024-07-07 22:09:09,+6395184***52,epwin kuha welcome bonus k pesos araw araw rebate sali mag enjoy epicgamb de,Smart,spam
2024-07-07 17:42:48,+6396493***07,tanggap number p mag register gamit number laro halaga na p upang kuha sali moolit de,Globe,spam
2024-07-07 12:48:08,+6395124***49,tanggap number p mag register gamit number laro halaga na p upang kuha sali raytag de,Smart,spam
2024-07-07 06:13:33,+6395170***62,long time no see good news sayo mag recharge p kuha p nang libre yystf ree nl,Smart,spam
2024-07-07 01:48:15,+6390912***85,gjluck de join gjp spin daily lucky wheel chance win samsung galaxy s g enjoy daily rebate sign,Smart,spam
2024-07-07 00:26:42,+6394838***90,g c s h advise ask verify account avoid deactivation click cut g cash helpcenter,Smart,spam
2024-07-06 10:14:10,+6396868***14,hi good day laro ba nline game bigay kita winning game taas chance manal ano ang oras lalar papano kawithdraw basta bahala sa akin reply yes po if interested,Smart,spam
2024-07-06 04:12:58,+6395191***36,tanggap number p sali gamit number lagay p upang kuha joypod de,Smart,spam
2024-07-06 00:44:41,+6390732***05,participate winningplus t g s casino win tournament win p oppo reno pro g p value enjoy daily rebate join wparena de,Smart,spam
2024-07-05 23:24:46,+6395110***46,sss contribution benefit expire collect july refer portal website phssss mx,Smart,spam
2024-07-05 18:08:34,+6393015***07,yg tanggap number p mag register gamit number laro halaga na p upang kuha sali joypod de,Smart,spam
2024-07-05 16:53:52,+6391003***51,yg tanggap number p mag register gamit number laro halaga na p upang kuha sali moolit de,Smart,spam
2024-07-05 16:03:27,+6395103***04,pesos mo gawin nating copy browser kklfph fyi,Smart,spam
2024-07-04 20:28:25,+6395122***84,ph soclal securlty system employer contribution lump sum payment benefit grant expire july pick ssssmy lc,Smart,spam
2024-07-04 18:22:38,+6391025***54,p credit tanggap number valid within hrs magregister lagay p upang maclaim cs boxlid de,Smart,spam
2024-07-04 13:20:17,+6390744***68,congrat vip ve win deposit bonus free fbs bonus claim s go contact customer service seize luck pnlkawin de,Smart,spam
2024-07-04 02:56:30,+6390733***46,p credit tanggap number valid within hrs magregister lagay p upang maclaim cs lc oo si ch s ts,Smart,spam
2024-07-03 16:18:09,+6395171***94,ready win big sbet vip offer p bonus new player enjoy p welcome bonus daily treat join sbgame de,Smart,spam
2024-07-03 16:05:29,+6390780***67,claim your b nus l g in kuha pes sa link to kklfph fyi,Smart,spam
2024-07-02 17:12:36,+6395179***80,join july s win tournament win p p bonus oppo reno pro g worth p hurry sign wplusbonu de,Smart,spam
2024-07-01 16:55:51,+6395132***50,bago na libre na bonus kundisyon deposit libre na bonus xxxx bisita,Smart,spam
2024-07-01 11:34:15,+6396858***77,p credit tanggap number valid within hrs magregister lagay p upang maclaim cs sa v rrn de,Smart,spam
2024-07-01 03:06:17,+6391026***87,p credit tanggap number valid within hrs magregister lagay p upang maclaim cs hipbow de,Smart,spam
2024-06-30 17:12:26,+6395150***33,baka sayo mi yahama mot r sali boaydp eu,Smart,spam
2024-06-29 14:45:47,+6390794***70,good day paghahatid ng post try deliver find order need verify drop check oib mx,Smart,spam
2024-06-29 14:34:25,+6393093***93,tanggap number p mag register gamit number laro halaga na p upang kuha sali nowjam de,Smart,spam
2024-02-05 18:11:17,+6390998***20,money watch youtube earn p day contact tutor receive p jueb bid,Smart,spam
2024-02-05 16:03:33,+6398555***61,cash bonus deposit day s fha bid,Smart,spam
2024-02-05 13:15:31,+6390704***45,february welcome come jilivip play slot win big prize deposit de yvjl,Smart,spam
2024-02-05 12:36:33,+6394636***84,kita nood youtube kita p araw makipag ugnay tutor tanggap p qytb bid,Smart,spam
2024-02-05 12:15:35,+6396388***68,betso x epicwin hi epic member attention not forget claim free credit inbox trust website epicwin tv,Smart,spam
2024-02-05 12:11:10,+6396381***89,get php for free join linksph eu msson,Smart,spam
2024-02-04 21:21:28,+6396497***15,new player jilivip deposit p p bonus de yvjl,Globe,spam
2024-02-04 14:07:03,+6394637***13,mag recharge p una na taon kuha p okwin tv,Smart,spam
2024-02-04 02:22:26,+6396347***62,banco de oro have issue account security review tera vin securitybdo sincerely banco de oro,Smart,spam
2024-02-03 18:22:25,+6398555***19,kita nood youtube kita p araw makipag ugnay tutor tanggap p cheg bid,Smart,spam
2024-02-03 14:23:05,+6396497***79,break news panalo poker dive pvp poker platform philippine bonus giving special prize come join panalo tv bonus,Globe,spam
2024-02-03 04:03:40,+6398539***42,money watch youtube earn p day contact tutor receive p hjga bid,Smart,spam
2024-02-03 03:14:27,+6398539***66,kita nood youtube kita p araw makipag ugnay tutor tanggap p gtyq bid,Smart,spam
2024-02-02 14:53:46,+6396351***69,new platform online lot discount new player register download app angapao p mysterious bonus jl tv reward,Smart,spam
2024-02-02 13:26:00,+6393035***29,finally thank god s friday gojackpot claim free p today february new player enjoy free p p join gojackpot tv,Smart,spam
2024-02-01 23:06:12,+6396490***72,new player jilivip register download app angapao p mysterious bonus jl tv bonus,Globe,spam
2024-02-01 15:51:41,+6396380***61,hello win prize p enter lmy de gerp,Smart,spam
2024-02-01 07:26:55,+6398555***10,easy daily salary p contact instructor mobile phone receive p novice red envelope qhmz bid,Smart,spam
2024-01-31 13:23:25,+6395050***83,kita nood youtube kita p araw makipag ugnay tutor tanggap p htka bid,Smart,spam
2024-01-31 10:53:02,+6395053***64,money watch youtube earn p day contact tutor receive p qhmz bid,Smart,spam
2024-01-31 01:15:17,+6395050***97,money watch youtube earn p day contact tutor receive p zheq bid,Smart,spam
2024-01-30 14:58:49,+6396495***25,cc promo free php cashout condition luck bonus bet free money linksph eu okfuz,Globe,spam
2024-01-29 20:04:57,+6395177***66,tomorrow s payday blast gojackpot jan new player grab p p bonus extra deposit bonus play win million prize gojackpot tv,Smart,spam
2024-01-29 19:34:28,+6393075***11,invite free b nus upto k p daily bonus p t miss jilislot vip com gslj fit crazyc,Smart,spam
2024-01-28 19:17:44,+6398556***63,begin journey prosperity grab new user giveaway jili p p let luck guide adventure jili c tv,Smart,spam
2024-01-28 13:25:37,+6396495***44,phlink eu pojcz cc promo free php register,Globe,spam
2024-01-28 12:04:23,+6395053***12,mag recharge p kuha p phwin tv,Smart,spam
2024-01-26 18:45:31,+6396490***09,win big price everyday k bonus log,Globe,spam
2024-01-26 04:22:27,+6395197***86,betso x epicwin welcome epic family promo alert deposit free wheel spin prize p trust website epicwin tv,Smart,spam
2024-01-26 00:24:14,+6394638***49,kita nood youtube kita p araw makipag ugnay tutor tanggap p cfth bid,Smart,spam
2024-01-25 21:15:01,+6396379***24,today th payday blast free p bonus gojackpot ready friday bonus p tomorrow new player free p p gojackpot tv,Smart,spam
2024-01-25 18:21:37,+6398539***15,money watch youtube earn p day contact tutor receive p bbmm bid,Smart,spam
2024-01-25 03:32:15,+6391045***07,kita nood youtube kita p araw makipag ugnay tutor tanggap p cfth bid,Smart,spam
2024-01-24 23:19:49,+6396496***54,click phlink eu myzrx cc member receive php free,Globe,spam
2024-01-24 06:00:54,+6394640***31,kita nood youtube kita p araw makipag ugnay tutor tanggap p qnhb bid,Smart,spam
2024-01-23 18:58:35,+6398599***68,money watch youtube earn p day contact tutor receive p iyyy bid,Smart,spam
2024-01-23 17:43:18,+6398539***39,money watch youtube earn p day contact tutor receive p akpp bid,Smart,spam
2024-01-23 16:34:17,+6396495***26,click phlink eu alf cc member receive php free,Globe,spam
2024-01-23 14:32:15,+6394611***92,kita nood youtube kita p araw makipag ugnay tutor tanggap p omjh bid,Smart,spam
2024-01-23 02:39:48,+6398555***05,kita nood youtube kita p araw makipag ugnay tutor tanggap p mnhb bid,Smart,spam
2024-01-22 15:25:34,+6396498***84,millionaire cb grand jackpot play,Globe,spam
2024-01-22 07:08:51,+6395191***12,betso x epicwin join free p today auto free p signup extra p deposit trust link epicwin icu,Smart,spam
2024-01-21 19:04:58,+6396495***94,banco de oro account restrict unrecognized attempt failure action result account termination hour update shot vin secure bdo,Globe,spam
2024-01-21 06:23:10,+6397055***91,banco de oro account restrict unrecognized attempt failure action result account termination hour update pub vin bdo login,Smart,spam
2024-01-20 17:11:26,+6395138***05,celebrate saturday winningplus double joy p new user p p free payday saturday bonus total p free winplus icu,Smart,spam
2024-01-20 16:33:32,+6396498***60,big prize cb bonus deposit,Globe,spam
2024-01-20 09:24:36,+6397048***41,banco de oro account restrict unrecognized attempt failure action wil result account termination hour update pub vin bdo recovery,Smart,spam
2024-01-19 21:57:15,+6398517***21,banco de oro account restrict unrecognized attempt failure action result account termination hour update shot vin bdo,Smart,spam
2024-01-19 19:12:56,+6397039***57,banco de oro account restrict unrecognized attempt failure action wil result account termination hour update pub vin bdo recovery,Smart,spam
2024-01-18 04:32:45,+6394868***98,banco de oro account restrict unrecognized attempt failure action result account termination hour update pub vin bdo secure,Smart,spam
2024-01-18 02:27:41,+6398557***18,discover wednesday luck sugarplay win giveaway extra deposit bonus p promotion sugarplayph icu,Smart,spam
2024-01-17 03:13:05,+6396354***16,banco de oro account restrict unrecognized attempt failure action result account termination hour update pub vin online bdo,Smart,spam
2024-01-17 01:59:25,+6398539***09,kita nood youtube kita p araw makipag ugnay tutor tanggap p opkh bid,Smart,spam
2024-01-16 20:52:56,+6394655***77,money watch youtube earn p day contact tutor receive p addd bid,Smart,spam
2024-01-16 20:11:43,+6398549***76,jili liveshow trialfund share bonus online welcomeb nus tny m crazytime jilislot vip com discover good baccarat site real coin,Smart,spam
2024-01-15 19:00:35,+6391044***60,turn toxic monday payday celebration gojackpot claim payday deposit bonus p enjoy p p bonus new player gojackpot icu,Smart,spam
2024-01-15 15:55:12,+6396302***41,banco de oro account restrict unrecognized attempt failure action result account termination hour update pub vin mybdo app,Smart,spam
2024-01-15 15:35:14,+6394854***77,kita nood youtube kita p araw makipag ugnay tutor tanggap p qqqm bid,Smart,spam
2024-01-15 14:00:24,+6394698***84,money watch youtube earn p day contact tutor receive p kyha bid,Smart,spam
2024-01-14 20:02:04,+6396476***87,you have p to claim visit suo yt huoj,Globe,spam
2024-01-14 06:50:37,+6394699***83,kita nood youtube kita p araw makipag ugnay tutor tanggap p zmmz bid,Smart,spam
2024-01-14 04:17:40,+6394625***31,money watch youtube earn p day contact tutor receive p kkka bid,Smart,spam
2024-01-14 02:52:29,+6396256***34,https dff dfd guru free bonus deposit condition,Smart,spam
2024-01-13 20:33:46,+6396366***41,magrehistro online laro kuha p lmy de dhjtm,Smart,spam
2024-01-13 16:14:26,+6398159***72,pwin araw araw b nus p una na deposito p b nus deposito rebate tny im vv,Smart,spam
2024-01-13 07:29:14,+6396353***40,unlon bank account restrict unrecognized attempt failure action result account termination hour update shorten myub protect,Smart,spam
2024-01-13 02:38:42,+6398555***77,money watch youtube earn p day contact tutor receive p opqw bid,Smart,spam
2024-01-13 01:15:31,+6396378***93,unlon bank account restrict unrecognized attempt failure action result account termination hour update shorten myub protect,Smart,spam
2024-01-12 23:29:18,+6394897***48,money watch youtube earn p day contact tutor receive p opqw bid,Smart,spam
2024-01-12 21:13:36,+6398538***82,money watch youtube earn p day contact tutor receive p faaf bid,Smart,spam
2024-01-12 04:40:42,+6394687***29,kita nood youtube kita p araw makipag ugnay tutor tanggap p bndd bid,Smart,spam
2024-01-12 02:59:36,+6398540***37,money watch youtube earn p day contact tutor receive p uy bid,Smart,spam
2024-01-10 19:47:27,+6396496***52,http phlinks center ausoi daily cashback sure safe pera mo,Globe,spam
2024-01-06 14:17:48,+6396494***71,sg kuha pula na sobre na cash araw araw taya http phlinks center fbn,Globe,spam
2024-01-06 13:26:49,+6396495***06,instant p bonus await download app enjoy free reward click http phlink center ztzhr,Globe,spam
2024-01-06 01:24:10,+6398531***96,dude part time car reviewer kumikita p araw makipag ugnay agad manager tanggap p newbie red envelope tl bid,Smart,spam
2024-01-05 22:18:31,+6394641***38,dude part time car reviewer kumikita p araw makipag ugnay agad manager tanggap p newbie red envelope tl bid,Smart,spam
2024-01-05 21:39:13,+6398531***21,imbita mo kaibigan mag recharge p kaibigan kuha p kuha p phl tv,Smart,spam
2024-01-05 14:53:42,+6391098***82,register free gift bonus new user register dep sit https suo yt vq o te,Smart,spam
2024-01-05 14:12:31,+6396494***02,sg kuha pula na sobre na cash araw araw taya http phlinks center tysgl,Globe,spam
2024-01-04 16:50:58,+6398584***86,panalo laki ngayon na bago na taon kuha new year egg smash deposit https suo yat p si yhy,Smart,spam
2024-01-04 13:53:23,+6396495***91,sg kuha pula na sobre na cash araw araw taya http phlinks center ll,Globe,spam
2024-01-02 22:40:25,+6396494***04,instant p bonus await download app enjoy free reward click http phlink center ap kf,Globe,spam
2024-01-02 22:29:43,+6391274***97,welcome winningplus embrace year win wellness claim ampao christmas event bonus https winplus icu,Smart,spam
2024-01-01 13:39:06,+6396494***46,new year luck join k s new year s bash peso credit deposit bonus massive luck boost start http phlink center newyear,Globe,spam
2023-12-31 14:05:42,+6398514***09,immerse luck sugarplay snatch p free bonus p giveaway maya welcome gift visit https sugarplay icu,Smart,spam
2023-12-31 13:45:42,+6394671***28,ligaya na bago na taon mo na tangkilik bonus oras deposito bet limitasyon beses asdo bid,Smart,spam
2023-12-31 10:19:02,+6395068***92,register free gift bonus new user deposit https suo yt nplmmey,Smart,spam
2023-12-30 22:02:37,+6396351***43,banco de oro account restrict unrecognized attempt failure action result account termination hour update shorten ee bdo online,Smart,spam
2023-12-29 18:45:46,+6391245***70,happy holiday download app p pree link https suo yt xyseffv,Smart,spam
2023-12-28 18:42:33,+6392835***97,receive welcome package day free golden egg day daily package p return pmo org y,Smart,spam
