date_received,sender,preprocessed_text,carrier,label
2024-02-25 16:43:39.644000,+63951****232,feel lucky today turn peso k money come fortune await ujlrgzpq nz not xossj bonus fm,Smart,spam
2024-02-25 16:02:38.771000,+63912****359,p mobile freebie plus p bonus una na deposito ok y sss hiyj t zoip io bonus lc,Smart,spam
2024-02-24 20:44:07.207000,+63951****384,eksklusibo mobile pa libre plus p p bonus rehistro dagdag una na deposito t bsvuvkzik bonus lc,Smart,spam
2024-02-24 18:34:33.237000,+63981****584,p mobile bonus tawag rehistro p p bonus una na deposito dagdag f g cn rs k cqllnbh bonus lc,Smart,spam
2024-02-24 15:43:30.072000,+63950****997,big win small bet peso k bet dare win s d f bid,Smart,spam
2024-02-24 12:23:57.917000,+63964****393,laro laki na platform kuha p bonus dagdag await first deposit alam bonus fm xvfgccqfdo r,Globe,spam
2024-02-24 08:20:17.343000,+63981****713,mo ba next big winner pesos lang fortune gems pwede ka na panalo k tara bonus fm uqhllenm,Smart,spam
2024-02-24 08:19:35.964000,+63985****201,mo ba next big winner pesos lang fortune gems pwede ka na panalo k tara bonus fm uqhllenm,Smart,spam
2024-02-24 03:18:40.931000,+63981****001,laro laki na platform kuha p bonus dagdag await first deposit alam promolink st gqrntnxqovyxio,Smart,spam
2024-02-24 01:15:10.779000,+63985****478,big win small stake peso k golden empire dare win bonus ms quywlk nk pwp,Smart,spam
2024-02-23 17:20:09.972000,+63981****245,libre na p mobile users plus sign up bonus p p doble deposito mo promolink st htqgtnugaod aj,Smart,spam
2024-02-23 15:15:58.959000,+63981****388,pa libre sayo mobile mag sign up kuha p p doble deposito bonus lc si nmlfpipaes,Smart,spam
2024-02-23 10:05:47.950000,+63981****357,mobile user p libre p bonus doblehin saya una na deposito mo bonus fm rkjlkitenuzk de,Smart,spam
2024-02-23 09:20:41.942000,+63930****411,mobile user p libre p bonus doblehin saya una na deposito mo bonus lc lk dpllxbs,Smart,spam
2024-02-23 07:08:15.738000,+63946****886,big win await peso k mega ace discover promolink sh vhmbpxmo s,Smart,spam
2024-02-22 22:59:36.257000,+63963****464,imagine turn small bet peso huge k win gold rush s possible find clickhere cx zj ffgk,Smart,spam
2024-02-22 22:25:58.418000,+63981****395,p mobile bonus p p welcome bonus doble una na deposito promolink sh xbo big jcgo,Smart,spam
2024-02-22 18:04:16.728000,+63950****548,p nang libre gamit mobile phone oo bonus una na deposito bv ak bid,Smart,spam
2024-02-22 16:47:54.701000,+63981****415,pharaoh s treasure offer chance win k peso dare win promolink st mbqmthj,Smart,spam
2024-02-22 15:44:44.953000,+63985****576,imagine peso turn k play gold rush visit bonus fm mvchnqqchhjvn magic,Smart,spam
2024-02-22 13:47:03.746000,+63985****965,income ba mag download app para maka receive ng free jl tv,Smart,spam
2024-02-22 11:14:23.676000,+63963****976,feel lucky today turn peso k money come fortune await bonus ms ytf ppku,Smart,spam
2024-02-22 09:04:43.872000,+63981****546,moment bet peso charge buffalo land k win play win promolink st ye vrpdc,Smart,spam
2024-02-22 08:49:42.925000,+63951****210,imagine peso turn k play crazy hunter visit promolink st ye vrpdc magic,Smart,spam
2024-02-22 05:41:21.879000,+63930****246,imagine turn small bet peso huge k win gold rush s possible find clickhere cx gvarnbal,Smart,spam
2024-02-22 04:00:53.455000,+63981****169,play big win peso gold rush k magic happen promolink st q ndfnoapklx,Smart,spam
2024-02-22 00:35:30.943000,+63930****804,moment bet peso golden empire land k win play win clickhere cx xlvfhiavcpk e,Smart,spam
2024-02-21 23:33:07.044000,+63951****668,transform day peso super ace potentially win k win story start bonus ms apdilha g ubie,Smart,spam
2024-02-21 22:24:53.119000,+63981****510,feel lucky today turn peso k baba fortune await clickhere cx pg,Smart,spam
2024-02-21 13:27:06.584000,+63970****413,greeting gcash advise require verify account avoid deactivation tomorrow verify llink ee savecare,Smart,spam
2024-02-21 06:18:39.710000,+63909****815,r histr nline pra lar makakuhaa p clickhere cx ri chsb,Smart,spam
2024-02-21 05:24:56.885000,+63964****730,congratulation gcash user receive p gcash loyalty team claim cash click link claim cash gcash prizeloyalty website claim thank choose gcash app,Globe,spam
2024-02-21 01:30:29.505000,+63981****516,dream turn peso k mega ace lucky star explore phpromo website p rvz w rtq,Smart,spam
2024-02-20 21:49:29.331000,+63981****844,hanap ikaw ba sunod mo na big win pesos lang crazy hunter baka k iuuwi mo check mo phpromo website i twwi ohtt uz,Smart,spam
2024-02-20 16:57:31.515000,+63912****848,congratulation gcash user receive p gcash loyalty team claim cash click link claim cash gcash receivedmoney website claim thank choose gcash app,Smart,spam
2024-02-20 11:44:22.007000,+63981****089,enjoy payday blast feb free p gojackpot new year wheel offer mitsubishi xpander samsung tv free p p gojackpotph icu,Smart,spam
2024-02-18 12:36:17.107000,+63963****980,grabe umulan nang scatter pesos bet k panalo clickhere cx iaeh vv pbxy,Smart,spam
2024-02-17 10:46:28.398000,+63910****575,kuha php nang libre bonus una na kapag click deposito phpromo website hbgh vx,Smart,spam
2024-02-17 09:41:41.178000,+63912****928,kuha php nang libre bonus una na kapag click deposito phpromo website hoixusjxagvn,Smart,spam
2024-02-17 06:57:08.269000,+63981****712,kuha php nang libre bonus una na kapag click deposito phpromo website og jpogdjhxhczdy,Smart,spam
2024-02-16 15:55:00.063000,+63985****317,bet pesos lang k win grabee ka din tlga super ace clickhere cx ljmwoqf m,Smart,spam
2024-02-16 09:52:03.930000,+63981****420,p free m bile phone oo bonus topup clickhere cx x chbqylix td,Smart,spam
2024-02-16 03:57:58.501000,+63930****341,enjoy feb friday free p bonu gojackpot spin love new year wheel glamira misubishi car samsung tv free p p gojackpotph icu,Smart,spam
2024-02-15 10:21:46.317000,+63951****034,grabe umulan nang scatter pesos bet k panalo clickhere cx l uz nyub,Smart,spam
2024-02-15 04:32:04.842000,+63964****436,p free m bile phone oo bonus dep sit clickhere cx w tv d gbbl u,Globe,spam
2024-02-14 06:31:33.959000,+63964****767,p free m bile phone oo bonus dep sit clickhere cx x aei mvjyu qny h,Globe,spam
2024-02-14 02:15:01.828000,+63964****963,p free m bile phone oo bonus dep sit clickhere cx sxq bnt,Globe,spam
2024-02-13 04:18:08.027000,+63985****311,mag log in app tanggap cash reward p cg tv,Smart,spam
2024-02-13 02:52:19.117000,+63964****106,bor laro muna free pesos una na deposito register clickhere cx bzs p vx,Globe,spam
2024-02-12 16:27:10.289000,+63930****743,need cash offer easy cash loan today simple requirement apply approve cash loan day message processing team viber thank,Smart,spam
2024-02-12 13:13:52.303000,+63951****058,congratulation gcash user receive p gcash loyalty team claim cash click link claim cash gcash loyaltyteam website claim thank choose gcash app,Smart,spam
2024-02-12 10:46:47.792000,+63970****393,february welcome come jilivip play slot win big prize deposit jl tv,Smart,spam
2024-02-12 09:57:22.573000,+63970****953,epicwin hi epic member cny bonus alert deposit claim free p limited claim trust website epicwin tv,Smart,spam
2024-02-12 07:51:33.666000,+63951****352,package deliver saturday t reply stop opt,Smart,spam
2024-02-12 07:50:23.164000,+63910****712,fedex shipment schedule delivery today,Smart,spam
2024-02-12 07:02:21.915000,+63981****970,g tv fb fg bago na libre na bonus kundisyon deposito mangyari na log in upang tanggap agad libre na bonus,Smart,spam
2024-02-12 02:40:30.063000,+63930****728,epicwin hi epic member cny bonus alert deposit claim free p limited claim trust website epicwin tv,Smart,spam
2024-02-11 01:02:49.873000,+63909****064,p cash download new user enjoy cash bonus recharge mini tv,Smart,spam
2024-02-09 00:53:20.208000,+63985****374,p cash download new user enjoy cash bonus recharge mini tv,Smart,spam
2024-02-08 02:41:37.308000,+63946****688,kita nood youtube kita p araw makipag ugnay tutor tanggap p ytbp bid,Smart,spam
2024-02-07 04:53:07.796000,+63985****124,money watch youtube earn p day contact tutor receive p gcrd bid,Smart,spam
2024-02-07 03:39:59.318000,+63985****680,kita nood youtube kita p araw makipag ugnay tutor tanggap p ytbp bid,Smart,spam
2024-02-06 17:47:27.033000,+63910****417,p cash download new user enjoy cash bonus recharge mini tv,Smart,spam
2024-02-06 17:31:03.059000,+63964****331,banco de oro have issue account security review tera vin onlinebdo secure sincerely banco de oro,Globe,spam
2024-02-06 10:08:35.602000,+63963****158,gcash alert advise ask update account avoid deactivation update gcash important advisory website,Smart,spam
2024-02-06 05:08:20.260000,+63985****306,p cash download new user enjoy cash bonus recharge mini tv,Smart,spam
2024-02-06 01:31:02.814000,+63963****139,supersugar win sugarplay offer k winning slot come join sugarplay tv winner,Smart,spam
2024-02-05 21:22:51.097000,+63963****930,betso x epicwin hi epic member attention not forget claim free credit inbox trust website epicwin tv,Smart,spam
2024-02-05 02:51:07.901000,+63946****458,money watch youtube earn p day contact tutor receive p jueb bid,Smart,spam
2024-02-05 00:00:54.260000,+63964****098,lunarfortune let win okada staycation iphone cbhome tv bonus,Globe,spam
2024-02-04 23:48:24.120000,+63948****418,kita nood youtube kita p araw makipag ugnay tutor tanggap p qytb bid,Smart,spam
2024-02-04 23:14:48.661000,+63964****394,congratulation gcash user receive p gcash loyalty team claim cash click link claim cash gcash appmoney website claim thank choose gcash app,Globe,spam
2024-02-04 20:08:38.083000,+63985****991,money watch youtube earn p day contact tutor receive p ghoo bid,Smart,spam
2024-02-03 18:34:44.157000,+63985****356,kita nood youtube kita p araw makipag ugnay tutor tanggap p gbcz bid,Smart,spam
2024-02-03 13:22:34.469000,+63985****323,mag recharge p una na taon kuha p okwin tv,Smart,spam
2024-02-02 18:15:52.688000,+63963****812,congratulation gcash user receive p gcash loyalty team claim cash click link claim cash gcash appcash website reward thank choose gcash app,Smart,spam
2024-02-02 15:44:34.112000,+63951****163,finally thank god s friday gojackpot claim free p today february new player enjoy free p p join gojackpot tv,Smart,spam
2024-02-02 03:53:08.616000,+63985****123,easy daily salary p contact instructor mobile phone receive p novice red envelope qatm bid,Smart,spam
2024-02-01 05:47:33.076000,+63948****725,easy daily salary p contact instructor mobile phone receive p novice red envelope wanp bid,Smart,spam
2024-01-31 11:55:19.039000,+63985****432,new player free p pagcor license official jili cashout min play gcash playzoneph tv,Smart,spam
2024-01-31 08:09:24.770000,+63985****162,kita nood youtube kita p araw makipag ugnay tutor tanggap p htka bid,Smart,spam
2024-01-30 06:31:49.247000,+63951****145,today s payday blast gojackpot jan new player grab p p bonus extra deposit bonus play win million prize gojackpot tv,Smart,spam
2024-01-29 16:21:43.224000,+63950****012,money watch youtube earn p day contact tutor receive p zhmg bid,Smart,spam
2024-01-29 08:15:09.095000,+63950****594,kita nood youtube kita p araw makipag ugnay tutor tanggap p fghj bid,Smart,spam
2024-01-29 04:08:22.337000,+63950****729,kita nood youtube kita p araw makipag ugnay tutor tanggap p fghj bid,Smart,spam
2024-01-28 17:33:09.060000,+63963****460,begin journey prosperity grab new user giveaway jili p p let luck guide adventure jili tv,Smart,spam
2024-01-28 13:10:06.411000,+63985****360,late jili popular game legal join free p suo yt xcf kfz,Smart,spam
2024-01-27 19:25:04.996000,+63981****848,begin journey prosperity grab new user giveaway jili p p let luck guide adventure jili c tv,Smart,spam
2024-01-27 14:05:27.180000,+63963****346,banco de oro have issue account security review shot vin secure bdo sincerely banco de oro,Smart,spam
2024-01-27 00:53:04.095000,+63963****126,receive interest apply unionbank credit card process application kindly send valid id processing team telegram receive d wait verification,Smart,spam
2024-01-25 23:30:56.162000,+63946****130,money watch youtube earn p day contact tutor receive p mmyy bid,Smart,spam
2024-01-25 19:37:34.065000,+63985****683,today th payday blast free p bonus gojackpot ready friday bonus p tomorrow new player free p p gojackpot tv,Smart,spam
2024-01-25 07:29:57.775000,+63964****359,panalo laki na premyo arawaraw up to kbonus,Globe,spam
2024-01-25 05:38:48.067000,+63963****496,banco de oro have issue account security review shot vin online bdo sincerely banco de oro,Smart,spam
2024-01-24 00:44:03.512000,+63951****353,level luck jili new player revel p p let luck guide thrilling adventure jili icu,Smart,spam
2024-01-23 09:41:05.463000,+63985****159,banco de oro account restrict unrecognized attempt failure action result account termination hour update shot vin onlinebdo,Smart,spam
2024-01-22 17:05:20.178000,+63985****663,level luck jili new player revel p p let luck guide thrilling adventure jili c icu,Smart,spam
2024-01-21 01:48:49.370000,+63964****486,k grand prize cbs red prosperity pouch,Globe,spam
2024-01-20 05:03:13.334000,+63963****837,banco de oro account restrict unrecognized attempt failure action result account termination hour update shot vin bdo online,Smart,spam
2024-01-19 16:48:08.999000,+63970****546,banco de oro account restrict unrecognized attempt failure action wil result account termination hour update pub vin bdo recovery,Smart,spam
2024-01-19 05:09:12.795000,+63985****384,money watch youtube earn p day contact tutor receive p teaq bid,Smart,spam
2024-01-18 15:31:22.426000,+63951****868,ready celebrate thank god s friday january free p gojackpot new userss free p p extra bonus gojackpotph icu,Smart,spam
2024-01-18 05:14:56.939000,+63963****398,bdo unibank thank bdo debit card shopee ph php recognize visit https bdoprotect info refund,Smart,spam
2024-01-18 03:30:08.619000,+63985****532,money watch youtube earn p day contact tutor receive p akkp bid,Smart,spam
2024-01-18 00:11:12.550000,+63985****880,new player free p pagcor license official jili cashout min play gcash playzone icu,Smart,spam
2024-01-17 06:55:48.616000,+63963****681,banco de oro account restrict unrecognized attempt failure action result account termination hour update pub vin bdo online,Smart,spam
2024-01-16 09:48:37.248000,+63985****366,kita nood youtube kita p araw makipag ugnay tutor tanggap p opkh bid,Smart,spam
2024-01-15 20:12:31.060000,+63985****252,kita nood youtube kita p araw makipag ugnay tutor tanggap p qqqm bid,Smart,spam
2024-01-14 19:41:00.882000,+63964****408,congratulation gcash user receive p gcash loyalty team claim cash click link claim cash https gcash getreward website claim thank choose gcash app,Globe,spam
2024-01-13 19:43:13.991000,+63946****432,double fun sugarplay icu claim giveaway promotion let win spree begin,Smart,spam
2024-01-13 14:51:09.936000,+63981****410,thank god s saturday winningplus claim free p today p p new player enjoy free deposit bonus win jackpot winplus icu,Smart,spam
2024-01-12 23:12:22.611000,+63985****789,recharge cash bonus ha bid,Smart,spam
2024-01-12 17:31:37.258000,+63946****480,kita nood youtube kita p araw makipag ugnay tutor tanggap p reqq bid,Smart,spam
2024-01-08 07:51:31.911000,+63985****572,win big today winningplus new player remember extra bonus p p free explore promotion vip clup https winplus icu,Smart,spam
2024-01-07 04:43:13.541000,+63964****238,lucky winner forthcoming lunar new year event give away free p incentive url login receive gift promotion available gcash verify user click claim https shorten gcashmobile,Globe,spam
2024-01-04 07:57:49.760000,+63909****451,imbita mo kaibigan mag recharge p kaibigan kuha p kuha p phl tv,Smart,spam
2024-01-04 01:25:42.600000,+63981****384,cheer sweet successful indulge delightful win generous sugarplay https sugarplay icu,Smart,spam
2024-01-03 19:35:44.802000,+63985****871,imbita mo kaibigan mag recharge p kaibigan kuha p kuha p phl tv,Smart,spam
2024-01-02 22:05:55.281000,+63963****426,betso x epicwin join free p today auto free p signup extra p deposit trust website https epicwin icu,Smart,spam
2024-01-02 19:45:01.769000,+63963****125,welcome winningplus embrace year win wellness claim ampao christmas event bonus https winplus icu,Smart,spam
2024-01-02 06:14:41.962000,+63981****684,newbie register p receive red envelope day https fish mba,Smart,spam
2024-01-01 02:00:42.844000,+63963****549,banco de oro account restrict unrecognized attempt failure action result account termination hour update shorten ee bdo officialsite,Smart,spam
2023-12-30 18:41:32.363000,+63963****964,banco de oro account restrict unrecognized attempt failure action result account termination hour update shorten ee secure bdo,Smart,spam
2023-12-30 02:38:57.789000,+63964****034,embrace winplus joy free p red packet weekday unlimited bonus free st deposit explore https winplus icu,Globe,spam
2023-12-29 07:45:52.453000,+63946****250,rekomenda kaibigan mag recharge p kuha p rebate phl tv,Smart,spam
2023-12-27 08:16:35.950000,+63964****654,betso x epicwin join free p today auto free p signup extra p deposit trust website https epicwin icu,Globe,spam
2023-12-27 08:16:16.762000,+63946****981,i download app tanggap p cash xcx bid,Smart,spam
2023-12-26 14:18:24.191000,+63951****337,christmas carnival bago na kkbe users kuha p recharging p x turnover xnd bid,Smart,spam
2023-12-26 06:13:55.914000,+63960****586,merry christmass foodpanda biker po namamasko po gcash dami na salamat po,Smart,spam
2023-12-26 05:39:58.276000,+63985****491,unlock gojackpot s fortunes st deposit bonus weekday free unlimited p christmas golden egg join https gojackpot icu,Smart,spam
2023-12-25 03:12:25.038000,+63909****998,christmas carnival bago na kkbe users kuha p recharging p x turnover sj bid,Smart,spam
2023-12-24 06:01:01.812000,+63985****468,christmas carnival bago na kkbe users kuha p recharging p x turnover sj bid,Smart,spam
2023-12-23 20:16:23.036000,+63963****884,unlock gojackpot s fortunes st deposit bonus payday free unlimited p christmas golden egg join https gojackpot icu,Smart,spam
2023-12-23 02:21:43.024000,+63963****314,celebrate christmas gojackpot not forget claim tgif friday bonus free p new user enjoy extra bonus https gojackpot icu,Smart,spam
2023-12-22 13:40:35.375000,+63909****183,mag recharge p araw araw kuha p cash lucky wheel win sdof bid,Smart,spam
2023-12-20 21:49:21.283000,+63985****540,good morning bro laro buo na gabi kita p poq a bid,Smart,spam
2023-12-18 05:31:51.715000,+63946****592,dear panalo p noon first time sali kkbet loa bid,Smart,spam
2023-12-17 23:52:51.098000,+63910****915,immerse luck sugarplay snatch p free bonus p giveaway maya welcome gift visit https sugarplay icu,Smart,spam
2023-12-17 19:20:04.384000,+63963****835,betso x epicwin join free p today auto free p signup extra p deposit trust website https epicwin icu,Smart,spam
2023-12-16 19:44:16.824000,+63985****689,sali kkbet bahagi p bonus araw araw sdu bid,Smart,spam
2023-12-16 04:40:55.605000,+63963****042,celebrate weekend payday bang gojackpot unlimited bonus sign bonus extra bonus https gojackpot icu,Smart,spam
2023-12-15 18:40:50.981000,+63985****387,man panalo lang p ligaya na pasko k bid,Smart,spam
2023-12-15 06:02:37.710000,+63909****327,good place hold provide new delivery address http phlpost eu irb y,Smart,spam
2023-12-15 04:05:07.076000,+63963****049,epicwin wish merry christmas register free peso small bet big win limit pax trust website https epicwin icu,Smart,spam
2023-12-14 09:21:02.062000,+63963****355,apply unionbank credit card credit card bank send quick message friendly processing team apply https m facebook com story php story fbid d apply enjoy high credit limit shop,Smart,spam
2023-12-14 00:51:45.245000,+63910****207,unlock ber month treasure https winplus icu fresh face receive free bonus k cashback maya dive excitement,Smart,spam
2023-12-13 10:12:38.387000,+63963****116,welcome gojackpot enjoy free sign bonus payday christmas golden egg bonus play jackpot https gojackpot icu,Smart,spam
2023-12-10 09:58:24.439000,+63912****549,package arrive warehouse deliver incomplete address information confirm address mypphlpolstt xyz rhyqsa,Smart,spam
2023-12-10 04:02:08.066000,+63909****712,kumpletu recharge i download app pareho na araw tanggap p cash mv xx loan,Smart,spam
2023-12-10 01:03:22.841000,+63963****361,embrace ber month gojackpot free golden egg php boost php bonus triumph round visit https gojackpot vegas,Smart,spam
2023-12-09 05:10:25.701000,+63985****762,kumpletu recharge i download app pareho na araw tanggap p cash lks w loan,Smart,spam
2023-12-09 04:17:08.025000,+63963****663,celebrate weekend gojackpot christmas golden egg unlimited free bonus payday bonus today free new https gojackpot vegas,Smart,spam
2023-12-07 20:08:27.629000,+63985****259,kumpletu recharge i download app pareho na araw tanggap p cash lks w loan,Smart,spam
2023-12-07 16:17:33.992000,+63963****934,enjoy winningplus payday bonanza free bonus new player enjoy deposit bonus free bonus win slot jackpot https winplus vegas,Smart,spam
2023-12-06 05:54:19.871000,+63946****474,restrict multiple login attempt visit follow instruction shorten bdo update sincerely banco de oro,Smart,spam
2023-12-06 00:56:07.852000,+63909****069,banco de oro account restrict unrecognized attempt failure action result account termination hour update shorten updatemybdo,Smart,spam
2023-12-03 12:45:21.638000,+63985****970,chance free b nus click register goal link goal space,Smart,spam
2023-12-03 10:18:12.618000,+63985****502,log in forward fb kuha p libre cj s loan,Smart,spam
2023-12-01 20:16:32.015000,+63963****802,pinaka mura na solar light sa market buy click buy https s lazada com ph s rjzmr solar light ka na pwede ilagay sa garden parking school business house outside wall buy plug play,Smart,spam
2023-12-01 16:29:19.241000,+63963****432,ber month fun await http jackpotcity vegas grab free golden egg php deposit boost php app bonus start play thrilling win,Smart,spam
2023-11-29 11:47:51.351000,+63963****912,need extra budget house improvement tuition fee grocery apply unionbank credit card credit card holder bank month experience high limit credit card shopping apply message processing team viber,Smart,spam
2023-11-29 11:13:12.309000,+63946****916,deposito p bet kuha p cash k xac loan,Smart,spam
2023-11-28 10:33:45.810000,+63985****063,deposito p bet kuha p cash k xac loan,Smart,spam
2023-11-25 05:00:46.970000,+63950****186,experience rush gojackpot unlock daily rebate unparalleled win rate seize free php bonus dive excitement gojackpot world,Smart,spam
2023-11-24 20:36:22.812000,+63985****722,banco de oro account restrict unrecognized attempt failure action result account termination hour update shorten bancodeoroupdate,Smart,spam
2023-11-24 09:45:00.336000,+63985****670,banco de oro account restrict unrecognized attempt failure action result account termination hour update shorten onlinebdoupdate,Smart,spam
2023-11-23 23:48:43.124000,+63985****238,banco de oro account restrict unrecognized attempt failure action result account termination hour update shorten online updatebdo,Smart,spam
2023-11-21 14:54:50.735000,+63985****348,kita ba lipas dalawa na araw sinungaling i really hope god bless you to win big bet loan,Smart,spam
2023-11-21 12:13:42.640000,+63985****637,banco de oro account activation need suspicious transaction kindly visit shorten onlineverificationbdo continue service,Smart,spam
2023-11-21 10:25:49.928000,+63985****391,banco de oro account activation need suspicious transaction kindly visit shorten bdoverificationonline continue service,Smart,spam
2023-11-20 01:27:57.699000,+63948****309,dear banco de oro bank customer account verification need system update follow instruction official web info online bdo com ph thank cooperation sincerely banco de oro,Smart,spam
2023-11-19 18:14:26.025000,+63985****726,dear banco de oro bank customer account verification need system update follow instruction official web info online bdo com ph thank cooperation sincerely banco de oro,Smart,spam
2023-11-19 10:44:24.894000,+63946****185,tito nagdeposito lang p bet kuha cash talo p halika bet loan,Smart,spam
2023-11-18 20:26:20.866000,+63950****841,swift transaction hefty bonus notch win rate gojackpot new user claim free bonus enter giveaway win big gojackpot ink,Smart,spam
2023-11-17 17:06:51.273000,+63985****561,banco de oro advise acc unt temporarily hold security purpose kindly visit shorten onlinebdoverify,Smart,spam
2023-11-16 22:54:39.033000,+63962****821,luck accident simply lucky join cl m p free reg ster piy life,Smart,spam
2023-11-16 10:55:52.555000,+63985****102,ayala bet online casino officially open register account p free b nus website ayala co,Smart,spam
2023-11-15 02:09:55.809000,+63985****735,dear banco de oro customer account verification need system update follow instruction officialapp info online bdo com ph thank cooperation sincerely banco de oro,Smart,spam
2023-11-14 16:22:33.449000,+63938****422,dear banco de oro customer account verification need system update follow instruction officialapp info online bdo com ph thank cooperation sincerely banco de oro,Smart,spam
2023-11-14 07:09:37.910000,+63910****957,join gojackpot s excitement new user claim free bonus aim bing bet race win plus extra paymaya gojackpot ink,Smart,spam
2023-11-14 07:08:39.821000,+63910****245,join gojackpot s excitement new user claim free bonus aim bing bet race win plus extra paymaya gojackpot ink,Smart,spam
2023-11-14 02:36:07.216000,+63985****253,dear banco de oro customer account verification need system update follow instruction official link update bdo ph thank cooperation sincerely banco de oro,Smart,spam
2023-11-13 18:02:34.118000,+63985****580,dear banco de oro customer account verification need system update follow instruction official link update bdo ph thank coop,Smart,spam
