date_received,sender,preprocessed_text,carrier,label
2023-05-09 08:22:48,+6395138***11,unionbank final warning notice new sim registration law update number https link yi continue receive otp,Smart,spam
2023-05-08 11:53:45,+6393076***81,unionbank final warning notice new sim registration law update number https link yh continue receive otp,Smart,spam
2023-05-07 20:37:25,+6392936***65,mo na kita pera nang dali mag imbita kaibigan w game kita premyo tinyurl com rec sm,Smart,spam
2023-05-07 06:11:46,+6399938***71,w game mag imbita kaibigan doon bago na kita pera laro tinyurl com w sm,Smart,spam
2023-05-06 05:27:33,+6396080***17,presyur trabaho sali w kita tulog tinyurl com w sm,Smart,spam
2023-05-05 19:42:07,+6391038***03,ub advisory account hold verify myunionbankph com register number active,Smart,spam
2023-05-05 09:02:59,+6396207***98,casino bingo slot lucky user register receive cash http okad life,Smart,spam
2023-05-04 09:08:44,+6396207***11,register receive p http jackpot guru receive cash red envelope day party bonus billion p,Smart,spam
2023-05-03 12:23:07,+6398561***08,top casino bingo slots geely users mag sign up upang dala cash http cddk store,Smart,spam
2023-05-03 10:26:38,+6398527***01,bdo online final warning register mobile number need update update mybdosecureph com continue receive time pin otp,Smart,spam
2023-04-30 12:26:43,+6398120***01,bdo online final warning register mobile number need update update bdo secure com continue receive time pin otp,Smart,spam
2023-04-30 10:55:18,+6394714***33,unionbank final warning register mobile number need update update https wal ee zuapa continue receive time pin otp,Smart,spam
2023-04-28 00:19:14,+6392072***63,problema ba kayo iba na sites platform slow cash in cash out hassle kayo q premyo and bonus qi org,Smart,spam
2023-04-26 16:44:01,+6398599***38,top casino bingo slots proxy promosyon dala cash http vip pkmf xyz,Smart,spam
2023-04-25 01:44:08,+6396080***07,cashback bago na dating p parehistro mag claim v ht glb uur,Smart,spam
2023-04-24 12:16:47,+6398592***59,top casino bingo slots geely users mag sign up upang dala cash http cddk store,Smart,spam
2023-04-23 17:17:32,+6396080***80,cashback bago na dating p parehistro mag claim v ht sm sat,Smart,spam
2023-04-23 01:10:49,+6396080***37,cashback bago na dating p parehistro mag claim v ht b rdd,Smart,spam
2023-04-22 14:09:00,+6396080***13,cashback bago na dating p parehistro mag claim w game ph jdb sm,Smart,spam
2023-04-21 17:53:13,+6396947***07,cashback bago na dating p parehistro mag claim w game ph sdf xw,Smart,spam
2023-04-20 21:54:34,+6396082***98,cashback bago na dating p parehistro mag claim w game ph pwl xw,Smart,spam
2023-04-20 05:33:56,+6396080***47,cashback bago na dating p parehistro mag claim w game ph zhd sm,Smart,spam
2023-04-19 20:07:25,+6396080***45,cashback bago na dating p parehistro mag claim w game ph zhd sm,Smart,spam
2023-04-19 16:11:08,+6394783***47,additional bonus una na deposito araw araw kuha additional bonus hintay mo http jackpot world,Smart,spam
2023-04-17 10:49:30,+6394779***95,bati kita mag log in lang ma claim taas lucky random red envelope http jackpot bio,Smart,spam
2023-04-16 21:22:43,+6396313***76,mag register kuha bonus p electronic game slot machines w game ph ggh ts,Smart,spam
2023-04-13 21:15:52,+6391221***87,cashback bago na dating p parehistro mag claim w B xyz,Smart,spam
2023-04-12 14:43:00,+6394771***53,newest hottest site jili game legit libre na pa swerte niyo sali http ok ada work,Smart,spam
2023-04-12 13:56:19,+6392858***30,mag sign up kuha p https v ht g vc kuha daan daan na bilyon na pula na sobre online araw araw,Smart,spam
2023-04-11 06:36:48,+6398154***36,cod new user regisrration gift peso firse recharge k peso open google search cod co link cod club,Smart,spam
2023-04-10 16:39:25,+6398525***55,bdo alert account hold security purpose kindly verify https mybdo updateonlineph com,Smart,spam
2023-04-09 16:09:00,+6394776***04,newest hottest site jili game legit libre na pa swerte niyo sali http okad life,Smart,spam
2023-04-07 10:04:58,+6391274***34,hello new free money bonus deposit condition login https qer org free money,Smart,spam
2023-04-06 19:27:41,+6390706***85,unionbank final warning register mobile number need update update https tpv sr uh nup continue receive time pin otp,Smart,spam
2023-04-06 14:50:27,+6394785***53,newest hottest site jili game legit libre na pa swerte niyo sali http swerte info,Smart,spam
2023-04-05 14:28:52,+6393839***55,final warn register mobile number need update update https sholi co unionbankotp continue receive time pin otp,Smart,spam
2023-04-03 17:08:06,+6393063***36,bdo alert account hold verify https bdounibankph com register number active,Smart,spam
2023-04-03 14:55:18,+6394775***78,new hot site jili games legit libreng p dito na ang swerte nyo sali na http fortunate wtf,Smart,spam
2023-04-03 13:52:09,+6398553***81,bdo alert register mobile number need update update https bdoaccess online update continue receive time pin otp,Smart,spam
2023-04-03 09:31:55,+6398524***53,bdo alert account hold verify https bdounibankph com register number active,Smart,spam
2023-04-01 18:22:08,+6398536***29,unionbank online account block unsuccessful login attempt unlock profile visit https oyn ubpblocked,Smart,spam
2023-04-01 14:35:01,+6398524***61,warning unionbank deactivate account security reason recent datum breach https oyn ubpbreached,Smart,spam
2023-03-31 10:44:19,+6396207***50,bati kita mag log in lang ma claim taas lucky random red envelope http swerte info,Smart,spam
2023-03-30 20:17:08,+6390705***82,bdo alert account hold verify https onlinebdo bankingph com sim reg register number active,Smart,spam
2023-03-29 13:14:25,+6396208***49,bati kita mag log in lang ma claim taas lucky random red envelope http fortunate wtf,Smart,spam
2023-03-28 00:54:54,+6394718***20,daily deal special need low price shopee today cash delivery order link https shoppe market ph,Smart,spam
2023-03-27 07:18:43,+6393075***85,hello win prize p enter https qw world,Smart,spam
2023-03-23 14:27:06,+6390784***54,new e commerce time job cashback shopping earn minimum p day contact https www facebook com dora,Smart,spam
2023-03-22 14:40:10,+6398548***69,final warning unionbank deactivate account security reason recent datum breach visit https jmp rzm kwe,Smart,spam
2023-03-21 17:08:32,+6393034***57,unionbank alert account lock fail login attempt reactivate hour https mx fe d avoid suspension,Smart,spam
2023-03-17 09:26:31,+6398514***61,ubpnotice need hold saving account recent update visit link unblock https url io s pj,Smart,spam
2023-03-16 17:34:39,+6398109***24,hello new free money bonus deposit condition login https fvb com free money,Smart,spam
2023-03-12 15:52:18,+6398563***08,want try different join betfil new platform free p play win betfildito com,Smart,spam
2023-03-12 13:42:42,+6396092***71,free free log https ty com come serve,Smart,spam
2023-03-04 14:00:47,+6398138***48,jp sign win p jp online bc bjf,Smart,spam
2023-02-25 12:06:22,+6398134***98,jili mega win x reward come win big https luck ynrwa,Smart,spam
2023-02-22 13:06:30,+6398119***68,free luckydraw p register https lcplay com bubx,Smart,spam
2023-02-21 14:09:38,+6398519***38,bdo advisory register mobile number need update today update https bdo mobile online sim continue receive time pin otp,Smart,spam
2023-02-17 18:14:43,+6398160***44,reachable call important write guzmandoug gmail com urgent talk,Smart,spam
2023-02-14 21:59:01,+6393995***89,laki na pl tf rm l gi panal patas lakas rehlstr i ci im r ffle tangg pa b nu lph ne k tse xyz,Smart,spam
2023-02-14 17:15:52,+6391239***02,kuha mo ung pera,Smart,spam
2023-02-13 17:46:15,+6392882***31,laki na pl tf rm l gi panal patas lakas rehlstr i ci im r ffle tangg pa b nu lph ne k tse xyz,Smart,spam
2023-02-13 01:17:06,+6393995***05,plnak l kas sa Asya madaii maiaki ganda na premy rehlstr gakaar na ch nc panalo b nu lph ne s sa kayan pw,Smart,spam
2023-02-12 13:54:47,+6398560***13,p free click https www bd com,Smart,spam
2023-02-11 15:18:30,+6398108***90,p free click https www com,Smart,spam
2023-01-04 15:14:44,+6398526***58,mo ba iwas hustle hindi mo subok si fizfak com sign up siya bahala premy hatid sayo p golden egg new member,Smart,spam
2022-12-29 13:25:47,+6394937***76,s claim baraha b nus p big event celebrate new year web baraha n site,Smart,spam
2022-12-26 21:44:48,+6396033***58,u claim baraha b nus p big event celebrate new year web pinasz life,Smart,spam
2022-12-26 04:59:05,+6398154***40,cod good online casino philippine register free bonus immediate cash promotion cod xyz,Smart,spam
2022-12-21 19:33:24,+6396043***62,gawe merry ang xmas win idownload ang app register link ye nb com d,Smart,spam
2022-12-18 14:37:15,+6390886***48,avail security bank orcr loan w take car nd hand car financing sure approval low rate inquiry text ask mark,Smart,spam
2022-12-15 23:35:09,+6396020***78,n day claim baraha b nus big event celebrate world cup web pinasm life,Smart,spam
2022-12-15 20:03:28,+6396023***13,d day claim baraha b nus big event celebrate world cup web pinasn life,Smart,spam
2022-12-15 13:52:57,+6391232***09,lapit pasko budget mo subok swerte kay breatheindesign com liveph free p golden egg agad,Smart,spam
2022-12-09 20:23:13,+6391023***17,philippines t p pl y vip bet year end dep b nu g veaway mobile friendly s gn n w pse lzpsa,Smart,spam
2022-12-09 06:55:37,+6398512***05,m jackpot prize peso play sign http free pic pc p bonus vip url php com,Smart,spam
2022-11-27 21:44:13,+6395175***65,t tangkilik world cup sl t football sali direkta na kuha p doble na deposit bonus web start y live,Smart,spam
2022-11-25 17:33:22,+6391081***56,u shopee eligible free p phone xiaomi chance reward web great r live,Smart,spam
2022-11-24 05:45:06,+6398524***49,download url https j app discount world s popular slot machine online cockfighte popular game,Smart,spam
2022-11-24 01:57:39,+6394937***58,lucky baraha prepare p today wait url card y life let s z,Smart,spam
2022-11-22 01:32:51,+6398527***24,baraha prepare p today wait url card q life lucky n,Smart,spam
2022-11-21 20:47:43,+6395110***53,thank trust smart p slot web v life,Smart,spam
2022-11-19 21:29:44,+6398527***71,crazy baraha p wait url card x live lucky e,Smart,spam
2022-11-18 18:56:01,+6398154***02,sugal hindi na need pumunta cas piay online manalo araw araw upto na welcome bonus hour cash web win w life,Smart,spam
2022-11-14 09:30:57,+6398163***02,cod good online casino philippine register free bonus immediate cash promotion cod cc,Smart,spam
2022-11-12 08:47:41,+6396028***81,welcome p s ot web qq life good luck d,Smart,spam
2022-11-10 18:30:33,+6394806***17,bdo online account register mobile number need update update online bdo serveuser com ph continue receive time pin otp,Smart,spam
2022-11-09 22:45:31,+6396035***16,true send bonus sl t registrat bonus bonus daily deposit bonus weekly monthly bonus web bonus n live winner m,Smart,spam
2022-11-09 15:51:31,+6391712***19,r u employ self employ avail k m interested txt,Globe,spam
2022-11-07 13:59:04,+6391712***46,hi m ms ruby avail k lowrate securedprocess interested text info,Globe,spam
2022-11-07 01:09:24,+6396027***87,true send bonus sl t registrat bonus bonus daily deposit bonus weekly monthly bonus web win c life winner,Smart,spam
2022-11-06 06:01:26,+6394850***95,stress agad traffic solusyon jan wala badtrip mo traffic try mo sigurado mag eenjoy ksibet com live,Smart,spam
2022-11-05 09:12:33,+6398143***81,hmm easy peso share facebook p bonus register http onlinegame beauty p t bonus php com,Smart,spam
2022-11-03 14:59:39,+6398104***33,enjoy baraha kita mag log in pwede kuha araw araw l nk wegoo live wow q,Smart,spam
2022-11-03 08:50:59,+6398104***79,enjoy baraha kita mag log in pwede kuha araw araw l nk lwon live wow r,Smart,spam
2022-11-02 21:52:46,+6396027***24,enjoy baraha kita mag log in pwede kuha araw araw l nk lwon live wow sa,Smart,spam
2022-11-02 16:06:29,+6398509***37,mo ba kita bonus rewards salamat kapag suporta g cash kuha slot bonus p web bonus x live,Smart,spam
2022-10-31 19:01:45,+6398158***33,scott w halloween event ay nandito na magrehistro manalo ng bonus promax ng libre w promax com halloween promax ah f w bgl,Smart,spam
2022-10-31 18:23:45,+6398122***54,hi scott maglaro ng sabong google verified app redeem free php game download wlucku com winnerclub search winner club play store,Smart,spam
2022-10-31 13:16:19,+6394630***72,hi sali direkta na kuha p doble na deposit bonus tangkilik super sa ot sd live w n,Smart,spam
2022-10-30 12:38:45,+6396036***65,pa mg enjoy ibat iba na card game maka kuha ng mega b nu s l nk biggoa live join now x,Smart,spam
2022-10-27 11:10:46,+6390993***13,xbet rgister use promo code hoopswish instant bonus tara na omsulpublisher com win,Smart,spam
2022-10-27 02:33:26,+6396027***65,cs online assist idownload lang ang xm app manalo p game itype ito sa browser ang xm com r,Smart,spam
2022-10-26 18:53:54,+6398523***48,hi sali direkta na kuha p doble na deposit bonus tangkilik super sa ot winpinaso live w na,Smart,spam
2022-10-26 11:03:31,+6390993***98,sigurado na puno stress trabaho tanggal stress pagod mo almurtazamobile com live,Smart,spam
2022-10-24 11:19:05,+6391241***12,monday nanaman sipag lang natin abot tagumpay mas sipag subok mo agirlsdawn com live saya kaaliw,Smart,spam
2022-10-24 11:10:16,+6390965***24,monday nanaman sipag lang natin abot tagumpay mas sipag subok mo agirlsdawn com live saya kaaliw,Smart,spam
2022-10-21 08:49:18,+6391281***26,salamat gamit google kuha p sponsor casin winpog live sl t phbestg live or goog e v,Smart,spam
2022-10-08 15:46:29,+6390995***34,p search w fb messenger receive s ot bo nus link kplay live v,Smart,spam
2022-10-07 16:22:31,+6394630***51,kung hindi ka sakim easy w n p day super slot surprise bonus win good web lplat live good web fplay live,Smart,spam
2022-10-04 14:57:06,+6391281***80,idol wag sobra na paka pagod mag chill mag relax muna sama si intersportchallans com live tanggal pagod mo,Smart,spam
2022-10-02 16:54:28,+6391281***73,happy weekend time mag hinga tambay sama si innolearntop com live sulit oras mo kapa kilala tara,Smart,spam
2022-09-30 13:16:00,+6394770***79,go w n jackp t totoo na pera cas no kuha una na rech arge mo web http dsplat live go ahead,Smart,spam
2022-09-30 13:01:05,+6394629***34,w hot spin game kuha iphone pro max scott mag sign up w kuha ilan na segundo w game com on,Smart,spam
2023-07-26 10:24:19,+6395122***60,unionbank final warning register mobile number need update update linkshr org continue receive time pin otp,Smart,spam
2023-07-25 14:17:19,+6394855***90,unionbank final warning register mobile number need update update link sm org continue receive time pin otp,Smart,spam
2023-07-22 07:45:04,+6390959***45,w games official partner with gcash magdeposito gamit pili na gcash kuha cashback araw araw http v ht sm zdl,Smart,spam
2023-07-19 14:08:57,+6396048***33,lahok laro doon taon na panalo p reward http lucky world,Smart,spam
2023-07-19 11:09:23,+6391717***95,getcash,Globe,spam
2023-07-16 11:14:27,+6396204***64,bati kita mag log in lang ma claim taas lucky random red envelope http lucky world,Smart,spam
2023-07-12 14:58:47,+6396048***03,cashback bago na dating p parehistro mag claim http go live,Smart,spam
2023-07-10 08:33:44,+6396204***21,bati kita mag log in lang ma claim taas lucky random red envelope http lucky world,Smart,spam
2023-07-09 03:08:10,+6390905***96,get p bonus w games sign try lnnk g iz,Smart,spam
2023-07-07 15:09:45,+6391938***11,cashback bago na dating p parehistro mag claim http lucky mom,Smart,spam
2023-07-07 13:25:04,+6390702***24,banco de oro account deactivate permanently fail confirm account verification come bdocaresverify,Smart,spam
2023-07-01 17:22:53,+6398152***13,hello new free money bonus deposit condition login www o p com free money,Smart,spam
2023-06-28 00:41:30,+6390876***14,w games exclusive gcash partner platform accept gcash philippine lnnk gpjz,Smart,spam
2023-06-27 14:56:31,+6396048***31,bati kita mag log in lang ma claim taas lucky random red envelope http lucky mom,Smart,spam
2023-06-27 02:53:14,+6392829***95,w games exclusive gcash partner platform accept gcash philippine lnnk chgq,Smart,spam
2023-06-27 01:16:15,+6390819***01,claim signup bonus game fc p e pw cnubeib,Smart,spam
2023-06-25 10:33:34,+6394637***13,greeting email important axsste wa gmail com,Smart,spam
2023-06-23 14:35:49,+6396048***36,bati kita mag log in lang ma claim taas lucky random red envelope http go world,Smart,spam
2023-06-23 01:55:46,+6390819***48,bet giveaway p win p register jr ph pw anebxu,Smart,spam
2023-06-22 17:07:39,+6392934***12,everyday win free bonus try bet check bonus jr ph pw jdnz j,Smart,spam
2023-06-22 14:13:12,+6392940***41,everyday win free bonus try bet check bonus jr ph pw jdnz j,Smart,spam
2023-06-21 14:44:46,+6391938***05,cashback bago na dating p parehistro mag claim http jackpot world,Smart,spam
2023-06-16 22:41:49,+6390879***54,w game tangi na platform pilipinas tanggap gcash deposito withdrawal sali w ba xyz,Smart,spam
2023-06-16 19:56:42,+6390835***61,w game tangi na platform pilipinas tanggap gcash deposito withdrawal sali w ba xyz,Smart,spam
2023-06-13 14:52:57,+6392961***98,cashback bago na dating p parehistro mag claim http maswerte city,Smart,spam
2023-06-13 11:26:20,+6398596***67,unionbank final warning register mobile number need update update https gbit fr fg q continue receive time pin otp,Smart,spam
2023-06-11 08:06:43,+6392939***73,bati kita mag log in lang ma claim taas lucky random red envelope http jack pot live,Smart,spam
2023-06-07 15:42:34,+6392967***32,bati kita mag log in lang ma claim taas lucky random red envelope http lucky world,Smart,spam
2023-06-07 02:21:43,+6392953***43,w game bigay regalo halina panalo iphone pro max p http tinyurl com sk zb,Smart,spam
2023-06-03 00:39:23,+6390828***14,lupit taas limitasyon sali w games limit k p bonus tinyurl com yck t au,Smart,spam
2023-06-02 14:42:49,+6392957***74,bati kita mag log in lang ma claim taas lucky random red envelope http swerte email,Smart,spam
2024-02-27 00:30:34,+6391221***62,p immediately deposit valid minute visit jili tv,Smart,spam
2024-02-26 21:34:27,+6398158***96,epicwin hi epic member cny bonus alert deposit claim free p limited claim trust website epicwin icu,Smart,spam
2024-02-26 20:06:37,+6397088***30,ready feb payday blast free p bonus spin new year wheel win mitsubishi toyota cars iphone claim free p p gojackpotph icu,Smart,spam
2024-02-26 09:15:11,+6397055***23,join gojackpot promo event free p bonus spin new year wheel win mitsubishi xpander tv free p p welcome bonus gojackpot tv,Smart,spam
2024-02-24 21:47:18,+6391200***63,greeting gcash advise require verify account avoid deactivation tomorrow verify llink ee gcare,Smart,spam
2024-02-23 23:35:00,+6396302***12,p free b nus gc ash c ash ut instant luckday start lmy de srfn jackpotjili com,Smart,spam
2024-02-21 19:20:10,+6398562***40,mobile gamer p libre pa p bonus rehistro una na deposito doble saya clickhere cx qjak piatlkzibkx,Smart,spam
2024-02-20 15:11:28,+6398112***49,taya nang saya libre na p deposit bonus sali clickhere cx pntvziogpzxs bv simula pagwawagi,Smart,spam
2024-02-20 12:35:56,+6391093***53,enjoy payday blast feb free p gojackpot new year wheel offer mitsubishi xpander samsung tv free p p gojackpotph icu,Smart,spam
2024-02-19 16:48:47,+6395119***12,good day gcash advise ask verify account avoid deactivation tomorrow verify llink ee caregcash,Smart,spam
2024-02-15 18:54:31,+6396497***24,p free m bile phone oo bonus dep sit clickhere cx jqolrwir,Globe,spam
2024-02-15 18:26:29,+6396493***75,grabe umulan nang scatter pesos bet k panalo clickhere cx l uz nyub,Globe,spam
2024-02-15 18:25:36,+6398106***67,grabe umulan nang scatter pesos bet k panalo clickhere cx l uz nyub,Smart,spam
2024-02-14 14:35:20,+6397018***91,join love event win glamira ring gojackpot spin new year fa cai wheel win samsung tv mitsubishi car new free p p gojackpotph icu,Smart,spam
2024-02-14 12:29:20,+6396497***91,p free m bile phone oo bonus dep sit clickhere cx lmqpqmq ju o hu,Globe,spam
2024-02-13 16:22:19,+6397052***93,deposit account share bonus win lose jl tv,Smart,spam
2024-02-13 13:49:50,+6397087***70,deposit account share bonus win lose jl tv,Smart,spam
2024-02-13 10:19:12,+6396497***49,bor laro muna free pesos una na deposito register clickhere cx bzs p vx,Globe,spam
2024-02-12 14:25:06,+6393001***25,epicwin hi epic member cny bonus alert deposit claim free p limited claim trust website epicwin tv,Smart,spam
2024-02-12 04:04:22,+6396497***75,cc promo free php topup register linkph eu cqwv rw tr y,Globe,spam
2024-02-10 19:23:52,+6396262***02,yy hello new free money bonus deposit condition login ta tv cuc free money,Smart,spam
2024-02-10 14:23:49,+6396340***30,greeting gcash advise require verify account avoid deactivation tomorrow verify llink ee savegcash,Smart,spam
2024-02-09 19:18:00,+6398538***56,deposito taon na panalo iphone pro max okwin tv,Smart,spam
2024-02-09 12:54:58,+6390843***16,yy hello new free money bonus deposit condition login phyy eu ucr free money,Smart,spam
2024-02-08 19:52:29,+6396379***13,spin new year lucky wheel fa cai wheel win mitsubishi xpander samsung tv claim friday s bonus tomorrow p new gojackpot tv,Smart,spam
2024-02-08 10:33:10,+6394867***30,money watch youtube earn p day contact tutor receive p webk bid,Smart,spam
2024-02-07 16:40:10,+6396498***63,february welcome come jilivip play slot win big prize deposit eu yvjl,Globe,spam
2024-02-07 10:30:06,+6398555***82,kita nood youtube kita p araw makipag ugnay tutor tanggap p mayc bid,Smart,spam
2024-02-06 01:19:48,+6398506***89,cc deposit promo free php php deposit cashout condition luck boost register linksph eu d p s,Smart,spam
2024-02-06 00:16:00,+6398532***75,money watch youtube earn p day contact tutor receive p zokf bid,Smart,spam
2024-06-06 16:10:52,+6396852***14,maswerte na tanggap p bonus msasdf pgwinwin fi,Smart,spam
2024-06-06 07:21:13,+6391289***52,libre na p mag lagay p upang kuha claimcenter uk,Smart,spam
2024-06-05 14:59:02,+6396233***50,bonus geniepot new member daily bonus p free download bonus genlepot ph,Smart,spam
2024-06-05 02:03:06,+6396842***22,hello bago na libre na bonus kailangan na deposito first deposit bonus and bonus for first deposit every day givepot ph,Smart,spam
2024-06-04 23:42:51,+6396852***77,ph social security system receive p sss check verify employer payment record sssc mx pzk h dj,Smart,spam
2024-06-04 11:50:07,+6396244***22,mag log in tanggap doon taon na panalo iphone pro l shj a uk ssiu v,Smart,spam
2024-06-02 22:56:08,+6390864***93,ph social security system benefit available total s member contribution p check employer contribution record sssy mx,Smart,spam
2024-06-01 03:26:33,+6396825***11,bonus geniepot new member daily bonus p free download bonus geniepot ph,Smart,spam
2024-06-01 02:30:28,+6394616***52,bigwin recharge p tanggap bonus naman p mas dami na recharge mas dami na tanggap link bigwin playwin so,Smart,spam
2024-05-31 13:33:48,+6394631***99,congratulation receive ss special invitation join free ss de,Smart,spam
2024-05-31 02:41:49,+6394670***44,refund account p bonus pa na lakip abala dinanas check mo credit mo dali claim bigwin ss b fo,Smart,spam
2024-05-30 20:26:27,+6391037***27,rrrgame ss b fo new member download p free right contact service,Smart,spam
2024-05-30 17:49:13,+6391085***28,fg ss b fo new member download p free right contact service,Smart,spam
2024-05-30 12:00:43,+6394671***24,rrrgame ss b fo new member download p free right contact service,Smart,spam
2024-05-29 04:03:10,+6396821***84,bonus geniepot new member daily bonus p free download bonus genlepot ph,Smart,spam
2024-05-27 23:15:53,+6394662***91,kick week gojackpot s monday bet tournament win xiaomi gjpph de join bonus p big win await new player,Smart,spam
2024-05-27 17:07:33,+6396849***04,bonus geniepot new member daily bonus p free download bonus genlepot ph,Smart,spam
2024-05-27 07:24:37,+6392834***15,need know news win money time bet klv o bbea uk deposit p win k bug,Smart,spam
2024-05-26 17:41:05,+6396235***04,sss member enrol payment method complete enrollment sss ifn vtqeun receive monthly benefit stipend,Smart,spam
2024-05-26 17:38:13,+6392941***21,domestic mail leave post office reach time delivery phlov check,Smart,spam
2024-05-26 05:54:24,+6396493***64,maswerte na jl tanggap p bonus ss b fo,Globe,spam
2024-05-24 19:15:27,+6394634***05,tgif bash participate bet tournament secure p bonus win xiaomi hurry slot fill rapidly gojackpotph de,Smart,spam
2024-05-24 17:10:54,+6393041***22,maswerte na jl tanggap p bonus luck so,Smart,spam
2024-05-24 00:12:01,+6391075***16,i unlock espesyal alok loyal customer pindut link cc la ifnn,Smart,spam
2024-05-23 14:34:01,+6391085***49,jl registration free bonus ka na salisa luck so,Smart,spam
2024-05-23 14:32:53,+6391093***32,jl registration free bonus ka na salisa luck so,Smart,spam
2024-05-21 18:37:27,+6391087***37,beat rainy day blue enter tournament chance xiaomi p new member join fun phwin de,Smart,spam
2024-05-21 17:06:29,+6395182***38,maswerte na jl tanggap p bonus cgs bigwwin ch,Smart,spam
2024-05-21 15:41:45,+6398531***27,phl ph domestic mail return local post office verify recipient identity phlma tw request delivery,Smart,spam
2024-05-21 14:55:40,+6394627***51,exclusive benefit wait free umbrella t shirt hat p bonus join telegram spinsphlive,Smart,spam
2024-05-21 00:53:10,+6391035***29,phl ph domestic mail return local post office verification recipient identity request delivery mdph tw,Smart,spam
2024-05-20 18:57:07,+6394896***13,phl ph domestic mail return local post office verify recipient identity phlma tw request delivery,Smart,spam
2024-05-20 18:57:52,+6394896***13,phl ph domestic mail return local post office verify recipient identity phlma tw request delivery,Smart,spam
